,sentence,sentence_confidence,start_time,end_time,date,original_audio
130," I've been out, I was supposed to but it was like, crap. I just drove as fast as I could away from the kitchen that, you know, it's like there's like a forest and like, like stuff in between the side of the highway. Yeah. I just fucking driving into me and we just went off the side but like, it was like, it was like like a bank. So, the thing that says, yeah, and so we, we just like, drove by it like that guy was like, fucking, you know, we call the police at like exactly where it was a windshield mirror but like, this guy was like, fucking going into us like, you know, I'm like, we would like, I'm like it if he had a crashed and I had just whatever I would have stopped, and I would have liked helped and everything like that. But like, if he was driving into Austin, you know, it's just like know, like I'm driving the fuck away from me. I got, it might be like, fucking off some shit. I like, yeah.",0.9723798036575317,0 days 00:32:56.200000,0 days 00:33:53.300000,03/09/22,220309_004_me.wav
131," That was like so fucking scary. Like, we were so proud enough to that. Like we like pulled the close, all the blinds in the house, you know, off the sound tonight when we driving back at like 1 a.m. Today from like calling me.",0.9542810916900635,0 days 00:33:54.400000,0 days 00:34:09.100000,03/09/22,220309_004_me.wav
132, That place out. There are Space Nine with a with a,0.6639812588691711,0 days 00:34:19.500000,0 days 00:34:23.300000,03/09/22,220309_004_me.wav
133," Will Ferrell Semi-Pro owner? Who got all this money from this one. Yeah, my parents must always have like a Thrilla crime, dramas.",0.9304920434951782,0 days 00:34:28.900000,0 days 00:35:01.900000,03/09/22,220309_004_me.wav
134, Axel Animal Clinic of choice.,0.7450398206710815,0 days 00:35:13.400000,0 days 00:35:15.100000,03/09/22,220309_004_me.wav
135, Second choice.,0.73558109998703,0 days 00:35:17.300000,0 days 00:35:18.700000,03/09/22,220309_004_me.wav
