,sentence,sentence_confidence,start_time,end_time,date,original_audio
425, Westbrook for today.,0.7302176356315613,0 days 01:18:06.400000,0 days 01:18:07.400000,03/16/22,220316_001_me.wav
426," Yeah, but they all this.",0.8479740023612976,0 days 01:18:14.500000,0 days 01:18:15.500000,03/16/22,220316_001_me.wav
427, Westgate Resort Campground like right out there on the streets.,0.8790529370307922,0 days 01:18:16.700000,0 days 01:18:22.500000,03/16/22,220316_001_me.wav
428, Java Java.,0.8152446746826172,0 days 01:18:27,0 days 01:18:28,03/16/22,220316_001_me.wav
429," Give him ask, cuz I feel.",0.7057575583457947,0 days 01:18:33.300000,0 days 01:18:34.900000,03/16/22,220316_001_me.wav
430, Give me one.,0.3404357433319092,0 days 01:18:40.800000,0 days 01:18:42.100000,03/16/22,220316_001_me.wav
431," Yeah, we should hide.",0.9295987486839294,0 days 01:18:46.600000,0 days 01:18:47.600000,03/16/22,220316_001_me.wav
432," I don't want to speak. So so do you guys have any rooms for tonight? Not, would you mind if we use your Wi-Fi to look at some hotels? Thank you so much. Thank you. Thank you. I got it.",0.939793586730957,0 days 01:18:59.100000,0 days 01:19:12.300000,03/16/22,220316_001_me.wav
433," I can we connect. Yeah, we saw this.",0.9121797680854797,0 days 01:19:17,0 days 01:19:20,03/16/22,220316_001_me.wav
434," Wednesday March 16th, what's up yesterday?",0.8058454394340515,0 days 01:19:27.300000,0 days 01:19:31.800000,03/16/22,220316_001_me.wav
435, I got Minnesota hospitals.,0.7252705693244934,0 days 01:19:36,0 days 01:19:37.600000,03/16/22,220316_001_me.wav
436, Oh 9000.,0.9668053388595581,0 days 01:19:38.800000,0 days 01:19:46,03/16/22,220316_001_me.wav
437, Lakeview private bathroom Provident Refrigeration to do it. This one only one that sold the other one to hospitals 106000.,0.8576787710189819,0 days 01:19:50.300000,0 days 01:20:04.100000,03/16/22,220316_001_me.wav
438, Don't do that.,0.6893914341926575,0 days 01:20:08.300000,0 days 01:20:10,03/16/22,220316_001_me.wav
439," Sorry, this will be like, total craziness, not to pay for it.",0.9167340397834778,0 days 01:20:11.300000,0 days 01:20:16.700000,03/16/22,220316_001_me.wav
440," If you got a plug Wi-Fi, I can. Okay.",0.8655135035514832,0 days 01:20:18.300000,0 days 01:20:24.100000,03/16/22,220316_001_me.wav
441, Becoming main cast country region.,0.7495768666267395,0 days 01:20:25.200000,0 days 01:20:30.200000,03/16/22,220316_001_me.wav
442, Us.,0.823115885257721,0 days 01:20:31.300000,0 days 01:20:32.200000,03/16/22,220316_001_me.wav
443, Flat twist with Arvest Online.,0.6853324174880981,0 days 01:20:42.200000,0 days 01:20:44.500000,03/16/22,220316_001_me.wav
444, When you think it's the one with the places?,0.9272379279136658,0 days 01:21:05.800000,0 days 01:21:08.400000,03/16/22,220316_001_me.wav
445," I can put in my check, put in credit card with my credit card. That doesn't work.",0.8273863196372986,0 days 01:21:09.700000,0 days 01:21:14.500000,03/16/22,220316_001_me.wav
446, Maybe we should have stayed off the camp. Maybe it's a hard to do this.,0.8621272444725037,0 days 01:21:22.400000,0 days 01:21:27,03/16/22,220316_001_me.wav
447," Well, that is bread and breakfast. Like,",0.819405198097229,0 days 01:21:28.800000,0 days 01:21:30.800000,03/16/22,220316_001_me.wav
448, Send it nicer.,0.6517168879508972,0 days 01:21:31.900000,0 days 01:21:33,03/16/22,220316_001_me.wav
449, And that is the only one.,0.7141000628471375,0 days 01:21:38.800000,0 days 01:21:40.200000,03/16/22,220316_001_me.wav
450," One, option weather for tonight.",0.7527064085006714,0 days 01:21:41.500000,0 days 01:21:43.100000,03/16/22,220316_001_me.wav
451, Together.,0.7888697385787964,0 days 01:21:45.500000,0 days 01:21:46.200000,03/16/22,220316_001_me.wav
452, This is that for one night and it popped passing. You're not working with Chelsea is going awesome to see if we can pay in cash.,0.8539304137229919,0 days 01:21:48.800000,0 days 01:22:03.500000,03/16/22,220316_001_me.wav
453, Now. This is Beth sofas that I can find it.,0.8660378456115723,0 days 01:22:05.700000,0 days 01:22:10.400000,03/16/22,220316_001_me.wav
454, This is a backup Place. Let's go to yours. Your spot first.,0.8241548538208008,0 days 01:22:15.800000,0 days 01:22:19.300000,03/16/22,220316_001_me.wav
455, For sure.,0.9495685696601868,0 days 01:22:20.200000,0 days 01:22:20.800000,03/16/22,220316_001_me.wav
456, Okay.,1.0,0 days 01:22:22.100000,0 days 01:22:23.900000,03/16/22,220316_001_me.wav
457, Let's just stay up.,0.8162566423416138,0 days 01:22:26.300000,0 days 01:22:27.600000,03/16/22,220316_001_me.wav
458, Do we book the whole room?,0.4063313901424408,0 days 01:22:42.200000,0 days 01:22:43.400000,03/16/22,220316_001_me.wav
459, You can I just cancel it.,0.7649055123329163,0 days 01:22:45,0 days 01:22:47.100000,03/16/22,220316_001_me.wav
460, There were a few nights.,0.4413132071495056,0 days 01:22:51.500000,0 days 01:22:53.800000,03/16/22,220316_001_me.wav
461," you, you",0.8908853530883789,0 days 01:22:59.300000,0 days 01:23:01,03/16/22,220316_001_me.wav
462, How much are Supreme wallpapers?,0.7283371686935425,0 days 01:23:04,0 days 01:23:06,03/16/22,220316_001_me.wav
463," Yeah, I know.",0.5728933215141296,0 days 01:23:07.500000,0 days 01:23:08.100000,03/16/22,220316_001_me.wav
464, Dammit on lamps. 7 minutes away.,0.76580411195755,0 days 01:23:23.900000,0 days 01:23:28.600000,03/16/22,220316_001_me.wav
465, You haven't left yet?,0.7392705082893372,0 days 01:23:31.300000,0 days 01:23:32.300000,03/16/22,220316_001_me.wav
466," Yeah, I know.",0.9689703583717346,0 days 01:23:34.800000,0 days 01:23:35.500000,03/16/22,220316_001_me.wav
467," No, I need, we need to cancel this shit. I don't know. Paint. 270 bucks. Yeah, it was so bright that side of town. So I do not want to be charged 270 box. It hasn't been walking and that score.",0.8966432213783264,0 days 01:23:38.400000,0 days 01:24:02.900000,03/16/22,220316_001_me.wav
468," Yeah, I know we need, we need to cancel this shit right now cuz we can say that we just booked them posten.",0.935100793838501,0 days 01:24:14.600000,0 days 01:24:20.100000,03/16/22,220316_001_me.wav
469," Yeah, I know. I don't know that they wouldn't have a cancellation policy.",0.9494445323944092,0 days 01:24:26.300000,0 days 01:24:29.600000,03/16/22,220316_001_me.wav
470," Hope they lost to cancel. If not, I guess we just stay.",0.9085003733634949,0 days 01:24:30.900000,0 days 01:24:34.800000,03/16/22,220316_001_me.wav
471, This one definitely has about 100%.,0.8680577874183655,0 days 01:24:40.900000,0 days 01:24:42.800000,03/16/22,220316_001_me.wav
472, It's like a nice apartment. Yeah.,0.9247692227363586,0 days 01:24:45.400000,0 days 01:24:47.400000,03/16/22,220316_001_me.wav
473," That has two Sofas in living room kitchen, view of the mountains.",0.8227343559265137,0 days 01:24:48.600000,0 days 01:24:53.300000,03/16/22,220316_001_me.wav
474," But that's the cost of two nights. So each night is only like 60 bucks, is only what last is only like 40 40 50 bucks more expensive.",0.8957129716873169,0 days 01:25:03.700000,0 days 01:25:13.400000,03/16/22,220316_001_me.wav
475," 4845 bucks, more Spencer.",0.7693545818328857,0 days 01:25:14.800000,0 days 01:25:17,03/16/22,220316_001_me.wav
476," No, it's exactly 45 bucks.",0.8720934987068176,0 days 01:25:20.800000,0 days 01:25:22.600000,03/16/22,220316_001_me.wav
477, Yeah.,0.6184052228927612,0 days 01:25:23.900000,0 days 01:25:24.200000,03/16/22,220316_001_me.wav
478, The one that's 22. X 64 tonight.,0.7750384211540222,0 days 01:25:25.600000,0 days 01:25:28.200000,03/16/22,220316_001_me.wav
479," Yes, versus 272 270. What's the difference between 180 and 2 * 2?",0.927882730960846,0 days 01:25:30.400000,0 days 01:25:35.800000,03/16/22,220316_001_me.wav
480," Or we can pay in can just like, it's like fine. We have that cash.",0.7649946212768555,0 days 01:25:39.100000,0 days 01:25:43,03/16/22,220316_001_me.wav
481, Like I have the Google Maps.,0.9753877520561218,0 days 01:25:46.800000,0 days 01:25:49,03/16/22,220316_001_me.wav
482, What Gomez?,0.8242412805557251,0 days 01:25:49.800000,0 days 01:25:51.500000,03/16/22,220316_001_me.wav
483, I know I am stopped when I try to talk to them and see if we can get cancellation.,0.9331072568893433,0 days 01:26:03,0 days 01:26:07.700000,03/16/22,220316_001_me.wav
484," Yeah, I know, but I need this. I want to pay 270 bucks. Not combated.",0.8849784731864929,0 days 01:26:10.300000,0 days 01:26:16.100000,03/16/22,220316_001_me.wav
485," Oh, because it's 272 270 box. But that is that is that is not converted. So the thing is a 270 box and we could pay the 170. 50 hundred thirty-five, you know, which I think is worth it. If we can pay in cash, we can pay in cash this imposter.",0.9394601583480835,0 days 01:26:18.900000,0 days 01:26:43.800000,03/16/22,220316_001_me.wav
486," Then I'll like take out no, no hesitancy with in regards to that.",0.8216134309768677,0 days 01:26:45.500000,0 days 01:26:49.800000,03/16/22,220316_001_me.wav
487," Possibly use up the pesos. Like we said, we would I don't think is apparently a free really good breakfast me so I can feel good.",0.8773956298828125,0 days 01:26:51.800000,0 days 01:26:58.900000,03/16/22,220316_001_me.wav
488, I say we fast on a hundred and I guess that's like fine for a hotel. Let you know. I'll see how much we've already spend.,0.8540907502174377,0 days 01:27:04.900000,0 days 01:27:12.200000,03/16/22,220316_001_me.wav
489, It's like almost there.,0.9356836676597595,0 days 01:27:19.100000,0 days 01:27:20.100000,03/16/22,220316_001_me.wav
490, Let's go that I got looks good.,0.8603463172912598,0 days 01:27:24.700000,0 days 01:27:27.100000,03/16/22,220316_001_me.wav
491," It was, let's wait.",0.6627140045166016,0 days 01:27:31.800000,0 days 01:27:33.900000,03/16/22,220316_001_me.wav
492, Nope.,0.4756127893924713,0 days 01:27:45.500000,0 days 01:27:46,03/16/22,220316_001_me.wav
493, Is the one that had.,0.767987847328186,0 days 01:27:56.400000,0 days 01:27:57.200000,03/16/22,220316_001_me.wav
494," So do you speak English by any chance? Yes, so I just like 5 minutes ago, but 10 minutes. Yes by booking. And I didn't know whether I was able to pay in cash or not here.",0.9170588850975037,0 days 01:28:26.800000,0 days 01:28:41.400000,03/16/22,220316_001_me.wav
495, Okay.,0.9729831218719482,0 days 01:28:43.800000,0 days 01:28:44.300000,03/16/22,220316_001_me.wav
496," Absolutely. Lovely. I can also pay at checkout by any chance because my, a bag is like, with a friend to a Carly backpacking, okay?",0.8606865406036377,0 days 01:28:45.300000,0 days 01:28:57.800000,03/16/22,220316_001_me.wav
497, I can't listen.,0.720907986164093,0 days 01:28:59.600000,0 days 01:29:00.400000,03/16/22,220316_001_me.wav
498," Yes, that's me campaign in cash. Right? Cuz we took out a lot of cash and then we have to get it back. So I submitted a cancellation request but like, ignore that if I would just, I just wanted, I didn't. Because when you decide that you charge the card, I was like, oh can I know? No, I haven't. I just sent a request to you guys.",0.9349308013916016,0 days 01:29:06.800000,0 days 01:29:30.700000,03/16/22,220316_001_me.wav
499, We can ignore.,0.9542291760444641,0 days 01:29:32.200000,0 days 01:29:32.900000,03/16/22,220316_001_me.wav
500, Okay. Thank you so much.,0.9876290559768677,0 days 01:29:34.200000,0 days 01:29:35.300000,03/16/22,220316_001_me.wav
501, What's this date is the 16th.,0.8934025168418884,0 days 01:29:38.800000,0 days 01:29:42.900000,03/16/22,220316_001_me.wav
502, Is this a date of issue is it? But okay.,0.9238419532775879,0 days 01:29:46.100000,0 days 01:29:51.400000,03/16/22,220316_001_me.wav
503, Really? What's the number?,0.9778344631195068,0 days 01:29:59.700000,0 days 01:30:02.300000,03/16/22,220316_001_me.wav
504," Number of nights, so too.",0.7926148176193237,0 days 01:30:04,0 days 01:30:06,03/16/22,220316_001_me.wav
505," 9 come by Tuesday nights, and I was like, I picked up.",0.8429715037345886,0 days 01:30:07.900000,0 days 01:30:13,03/16/22,220316_001_me.wav
506, Send it.,0.7780516147613525,0 days 01:30:21.600000,0 days 01:30:23.400000,03/16/22,220316_001_me.wav
507," We wonder what's up. Do you have a piece of local knowledge. So when I was backpacking by I think a spider or something and you might hand like it's wall is swelled up, you know, if there any poisonous spiders around here.",0.9060873985290527,0 days 01:30:28.300000,0 days 01:30:43.900000,03/16/22,220316_001_me.wav
508," No, that would be fantastic. Cuz it's been. It's been pretty swollen.",0.8120647072792053,0 days 01:30:44.300000,0 days 01:30:48.700000,03/16/22,220316_001_me.wav
509, Awesome. Yeah.,0.9322144985198975,0 days 01:30:53.700000,0 days 01:30:55.300000,03/16/22,220316_001_me.wav
510," And thank you so much. Yeah, cuz it's been hurting a little bit. We just came back from Fitzroy and Winston. Oh, yeah, and so we coming, but I'll tent the tent. We've rented out, the zipper didn't work. So we couldn't close the tents at 3. Have to put the safety pins.",0.9399031400680542,0 days 01:30:57.400000,0 days 01:31:25.900000,03/16/22,220316_001_me.wav
511, One will be here.,0.9182988405227661,0 days 01:31:35.700000,0 days 01:31:38.800000,03/16/22,220316_001_me.wav
512, Awesome. Thank you so much.,0.7210939526557922,0 days 01:31:44.500000,0 days 01:31:49.100000,03/16/22,220316_001_me.wav
