,sentence,sentence_confidence,start_time,end_time,date,original_audio
166," Will you lie with your phone? Will let me wife. I will let me Wi-Fi off to go to bed. No, no worries. I just a little Midtown so I might not be expensive.",0.8861887454986572,0 days 00:32:35.200000,0 days 00:32:58.300000,03/09/22,220309_014_me.wav
167, We can talk.,0.5362227559089661,0 days 00:32:59.300000,0 days 00:33:00.300000,03/09/22,220309_014_me.wav
168, OU.,0.8016084432601929,0 days 00:33:03.400000,0 days 00:33:04.400000,03/09/22,220309_014_me.wav
169, Please enter a valid address.,0.9876290559768677,0 days 00:33:08.400000,0 days 00:33:10,03/09/22,220309_014_me.wav
170, Santa just like Street.,0.7449316382408142,0 days 00:33:11.700000,0 days 00:33:14,03/09/22,220309_014_me.wav
171, The theme is increasing. I can't do any of the cuz otherwise I'll things on the far end.,0.6974026560783386,0 days 00:33:14.900000,0 days 00:33:20.500000,03/09/22,220309_014_me.wav
172, Please enter a valid City.,0.9727226495742798,0 days 00:33:25.300000,0 days 00:33:27,03/09/22,220309_014_me.wav
173, Adele.,0.5215839743614197,0 days 00:33:43.200000,0 days 00:33:43.900000,03/09/22,220309_014_me.wav
174," I need to go to the airport because since you're traveling as an unaccompanied to mine. The app, is that what you put on?",0.8551425933837891,0 days 00:33:57.400000,0 days 00:34:13.600000,03/09/22,220309_014_me.wav
175, In Swedish stopping. I don't do any of this.,0.8611765503883362,0 days 00:34:16.100000,0 days 00:34:27.100000,03/09/22,220309_014_me.wav
176, Would you do? What are you guys doing? Got beyond anything because it deletes.,0.9149510264396667,0 days 00:34:29.900000,0 days 00:34:37.100000,03/09/22,220309_014_me.wav
177, Before cuz I can do a Visa waiver because Swedish residence cuz it's thinks I'm a Swedish last minute. This stupid infant in lap.,0.8959105014801025,0 days 00:34:38.500000,0 days 00:34:47.800000,03/09/22,220309_014_me.wav
178," Okay, I'll check in at the airport. Can you kidding me or at ports?",0.7790966033935547,0 days 00:34:51.900000,0 days 00:34:55.200000,03/09/22,220309_014_me.wav
179," Cuz I asked him to take a walk know, this is for checking I am I have a green card. So but the problem is is that every time since my passports, a Swedish passport, even though I vented in my green card, he had it like I need to like wave my thing cuz it thinks I'm a Swedish residence and it keeps go and wave that is, that's my dresser. And then it just it says something went wrong and it just exit out all of my",0.9427939653396606,0 days 00:34:57.700000,0 days 00:35:38.800000,03/09/22,220309_014_me.wav
180," I just think he's actually, I think.",0.7042480707168579,0 days 00:35:40,0 days 00:35:43.300000,03/09/22,220309_014_me.wav
181, I can't.,0.623137354850769,0 days 00:35:44.500000,0 days 00:35:45.300000,03/09/22,220309_014_me.wav
182, But what about how long are all these documents take you?,0.9227281808853149,0 days 00:35:46.100000,0 days 00:35:48.900000,03/09/22,220309_014_me.wav
183, I don't think you can do to help you. What's this?,0.7996516823768616,0 days 00:35:51.600000,0 days 00:35:56,03/09/22,220309_014_me.wav
184, That is just hit that stupid.,0.9283244013786316,0 days 00:36:15.700000,0 days 00:36:17.900000,03/09/22,220309_014_me.wav
185," I mean, Lacey.",0.7231352925300598,0 days 00:36:20.400000,0 days 00:36:21.300000,03/09/22,220309_014_me.wav
186, C a. I d like to live like that. I conduit like code.,0.8141053915023804,0 days 00:36:29,0 days 00:36:32.200000,03/09/22,220309_014_me.wav
187, It's like missing Pounders. Would you look at that? What they bought these socks?,0.7862549424171448,0 days 00:36:36.400000,0 days 00:36:40.800000,03/09/22,220309_014_me.wav
