,sentence,sentence_confidence,start_time,end_time,date,original_audio
0,I would love to taste this walk.,0.690670907497406,0 days 00:00:10.400000,0 days 00:00:13.700000,04/07/22,220407_003_me.wav
1, Antenna.,0.607460618019104,0 days 00:00:15.400000,0 days 00:00:16,04/07/22,220407_003_me.wav
2, We can we get the rich Asian food. We don't have to drive that far from good Aid open until it's still in the vents to go sit like 20 minutes away till I get the whole like diamond.,0.9265093803405762,0 days 00:00:17.200000,0 days 00:00:28.100000,04/07/22,220407_003_me.wav
3," But there are so many good restaurants, right? And not like, still in the middle. Like that's not lacking in food is, I mean, I mean,",0.9112005829811096,0 days 00:00:30.700000,0 days 00:00:39.100000,04/07/22,220407_003_me.wav
4, Korean the same as BBQ Asian Foods.,0.6618847250938416,0 days 00:00:41.800000,0 days 00:00:44.600000,04/07/22,220407_003_me.wav
5, Scallion pancakes.,0.8893419504165649,0 days 00:00:46.300000,0 days 00:00:47.800000,04/07/22,220407_003_me.wav
6, But like East is a different direction. Yeah.,0.9357877373695374,0 days 00:00:55.600000,0 days 00:01:00.300000,04/07/22,220407_003_me.wav
7," Like one of the only option, 35, like almost the only called, you know, that is like, naughty oriented is India. And then, yeah, I did, I did.",0.9086722731590271,0 days 00:01:03.200000,0 days 00:01:18.800000,04/07/22,220407_003_me.wav
8," God. Do I have to like, since I haven't written like poetry in been doing this, your stuff in a while. It's like I'm trying to like",0.8943526148796082,0 days 00:01:20.600000,0 days 00:01:27.300000,04/07/22,220407_003_me.wav
9," You know, I haven't like spoken.",0.9245508313179016,0 days 00:01:29.100000,0 days 00:01:30.700000,04/07/22,220407_003_me.wav
10," Oh, yeah, I love it. It's it's sick. It's so much. It's so beautiful for me. I left the bike until it gets difficult.",0.927405834197998,0 days 00:01:34.600000,0 days 00:01:41.800000,04/07/22,220407_003_me.wav
11, I'll also we have to communicate book or the or something.,0.788118302822113,0 days 00:01:45.500000,0 days 00:01:52.200000,04/07/22,220407_003_me.wav
12, I would like a.,0.8625262975692749,0 days 00:01:53.300000,0 days 00:01:55.500000,04/07/22,220407_003_me.wav
13, I'd be fucking beautiful.,0.8033556938171387,0 days 00:02:00.100000,0 days 00:02:01.100000,04/07/22,220407_003_me.wav
14," we can, like,",0.9492759704589844,0 days 00:02:02.200000,0 days 00:02:03,04/07/22,220407_003_me.wav
15," Oh, yeah, I understand.",0.9511581659317017,0 days 00:02:04,0 days 00:02:05.100000,04/07/22,220407_003_me.wav
16, Watch out.,0.7987053990364075,0 days 00:02:07.700000,0 days 00:02:08.500000,04/07/22,220407_003_me.wav
17, It's really nice. I'm temperature.,0.9633658528327942,0 days 00:02:12.900000,0 days 00:02:15,04/07/22,220407_003_me.wav
18, I love biking with you.,0.9053994417190552,0 days 00:02:16.700000,0 days 00:02:18.200000,04/07/22,220407_003_me.wav
19, Where she go?,0.4661041796207428,0 days 00:02:20.300000,0 days 00:02:21.100000,04/07/22,220407_003_me.wav
20," That's if we're going to do K-Town. Now, let's try to go like right away cuz otherwise we'll get like my it and then we",0.924813449382782,0 days 00:02:24.700000,0 days 00:02:32,04/07/22,220407_003_me.wav
21, I can get up to the,0.8810831904411316,0 days 00:02:41.300000,0 days 00:02:42.500000,04/07/22,220407_003_me.wav
22," this guy before the stop sign before, that is next.",0.9077884554862976,0 days 00:02:45,0 days 00:02:48.900000,04/07/22,220407_003_me.wav
23, Maybe a little low.,0.7157333493232727,0 days 00:02:58.100000,0 days 00:02:59,04/07/22,220407_003_me.wav
24, Yes.,0.9538674354553223,0 days 00:03:01.700000,0 days 00:03:02.200000,04/07/22,220407_003_me.wav
25," One thing that I noticed but like I feel like I do by Vance wrong sometimes because I I often use the best hours of the day or I mean, this is everyday almost, you know, it's like I found it like these to be able to walk all night and be stay up like every night and walk all night, like lost that it failed. I feel like it is. It's like now it's like okay I have like, you know,",0.951801598072052,0 days 00:03:06.800000,0 days 00:03:31.700000,04/07/22,220407_003_me.wav
26," The time, good hours of walking in the day. And then and then I, Then I then I like crash at like 10 and like, the bad part is that I spend all of those. Like, a taoism often times like talking to people going to run some errands with time today.",0.9485608339309692,0 days 00:03:33.300000,0 days 00:03:50.500000,04/07/22,220407_003_me.wav
27, Gotha.,0.4238049387931824,0 days 00:03:51.400000,0 days 00:03:52.100000,04/07/22,220407_003_me.wav
28," I will pick up some comments, and he doesn't understand me, but he just",0.8958176374435425,0 days 00:03:55.400000,0 days 00:03:59.700000,04/07/22,220407_003_me.wav
29," I've seen him like that before. Yeah, one one every once in a while. Are you like it?",0.8325765132904053,0 days 00:04:02.400000,0 days 00:04:10.700000,04/07/22,220407_003_me.wav
30," You just said something about. I forgot what he said, register. I just felt like I do. I felt recognized in a way that I don't know. Think so, maybe I think he thinks I'm avoiding everyone which is true.",0.9151932597160339,0 days 00:04:12.800000,0 days 00:04:22.500000,04/07/22,220407_003_me.wav
31," Yeah, I see that. You feel. Like coldness.",0.7781230211257935,0 days 00:04:29.700000,0 days 00:04:32.600000,04/07/22,220407_003_me.wav
32, I feel that way on the way back.,0.8454294800758362,0 days 00:04:38.200000,0 days 00:04:39.800000,04/07/22,220407_003_me.wav
33, Raising Cane's.,0.9099197387695312,0 days 00:04:57.400000,0 days 00:04:58.200000,04/07/22,220407_003_me.wav
34, Release.,0.499799907207489,0 days 00:05:12,0 days 00:05:12.700000,04/07/22,220407_003_me.wav
35, Wake me up in a half an hour 45 minutes to 25%.,0.7604325413703918,0 days 00:05:20.300000,0 days 00:05:31.700000,04/07/22,220407_003_me.wav
36," Your auction go at like, filling your brain with oxygen, how you're feeling of rain with lichen stations in like the wild. I know it just does something good when you're working and it stays active. After a walk from like for pretty long though. It's really tough to walk by like an ideal conditions. Like a good walk is like the best thing you can do for your mind if you want it. Yeah, but the question of liking my friends and I have been avoiding them playing Penn's like each friend if they, if a different for each friend, you know,",0.9578627943992615,0 days 00:05:35.600000,0 days 00:06:08.400000,04/07/22,220407_003_me.wav
37, I think it's difficult to reconcile the idea of myself.,0.9725705981254578,0 days 00:06:13,0 days 00:06:16.400000,04/07/22,220407_003_me.wav
38," I've been calling to realize that I haven't really been thinking about myself, but like we don't find many people.",0.9339786767959595,0 days 00:06:17.200000,0 days 00:06:25,04/07/22,220407_003_me.wav
39, 10:04. We feeling like I was thinking about so much and I will be reflecting the phone.,0.7206021547317505,0 days 00:06:28,0 days 00:06:35.900000,04/07/22,220407_003_me.wav
40," Play, even thinking about signing.",0.790967583656311,0 days 00:06:38.100000,0 days 00:06:42,04/07/22,220407_003_me.wav
41, Office call at 4 / 10.,0.8950002789497375,0 days 00:06:48.100000,0 days 00:06:53.200000,04/07/22,220407_003_me.wav
42, Friends.,0.8712039589881897,0 days 00:06:55.300000,0 days 00:06:59.200000,04/07/22,220407_003_me.wav
43," You know, who?",0.8742556571960449,0 days 00:07:03.200000,0 days 00:07:04.800000,04/07/22,220407_003_me.wav
44," But you might become like your eyes and I hope, you know, when walking like a diamond, Neenah, Wisconsin.",0.8581161499023438,0 days 00:07:07.300000,0 days 00:07:21.700000,04/07/22,220407_003_me.wav
45," And I come like Alvarez their eyes at 8 for others, like, absolutely.",0.8136409521102905,0 days 00:07:26.600000,0 days 00:07:32.300000,04/07/22,220407_003_me.wav
46, I am lucky. I'm looking like I did a group of ideas and things that I can come to my house and I would like to Google.,0.8106126189231873,0 days 00:07:34.400000,0 days 00:07:49.700000,04/07/22,220407_003_me.wav
47, Is it right back with you yet? He would like to Okemos. Hobby property should be like money.,0.7871679067611694,0 days 00:07:55.800000,0 days 00:08:08.500000,04/07/22,220407_003_me.wav
48, Stupidest car in the world.,0.5852569937705994,0 days 00:08:39.300000,0 days 00:08:40.500000,04/07/22,220407_003_me.wav
49," Yes, I mean the thing is is that like it's supposed to feel like no matter how to make like exclusive skin condition season 1. Can I use the one being, you know, I like to see a place. You would never approve. Play hot like Thursday in the same way with like with the boys.",0.8966326117515564,0 days 00:08:55,0 days 00:09:38.700000,04/07/22,220407_003_me.wav
50," I would love to get to know what is it in the same way, right? In front of the spiritual.",0.8532791137695312,0 days 00:09:44.500000,0 days 00:09:57.400000,04/07/22,220407_003_me.wav
51," Exactly, right.",0.9843020439147949,0 days 00:09:59.300000,0 days 00:10:00.200000,04/07/22,220407_003_me.wav
52," It's not like I do, you know, has the comment like any cases McNaughton Society like that. To love real lady, but that makes a magnet is like I, you know, like you will keep your grandmother's house, you know.",0.8950864672660828,0 days 00:10:03.500000,0 days 00:10:25.300000,04/07/22,220407_003_me.wav
53, But it becomes like a like a political statement or like about you about you signaling. The reason why I like Simon like doesn't like it and then was it cuz the thing is like a,0.9086997509002686,0 days 00:10:31.500000,0 days 00:10:42.500000,04/07/22,220407_003_me.wav
54," Ultimate. It is a lot like it for him is like, you know, it was a good start to call Princess home. And there's like a Some Like it Like dumb ass onstage. You like even and acknowledgement.",0.9113015532493591,0 days 00:10:43.900000,0 days 00:11:00.200000,04/07/22,220407_003_me.wav
55," It's like, precisely.",0.9187645316123962,0 days 00:11:01.200000,0 days 00:11:03.900000,04/07/22,220407_003_me.wav
56," It's it it just it just feels like this coordinates, you know, and cuz it's like separated.",0.8720202445983887,0 days 00:11:05.200000,0 days 00:11:10,04/07/22,220407_003_me.wav
57," Yeah, but even just separated from with the issues in the would have just the spirit of it, right? It is not like a land acknowledgement can be like a like a piece of hot then you know, like I know there's much more thing is that can like it create the spirits and make you understand.",0.9063529968261719,0 days 00:11:12.100000,0 days 00:11:30.800000,04/07/22,220407_003_me.wav
58," Exactly. That is like, you know, what you want should do because because because the thing is that you say goodbye, pause. Haven't even to think about the actual. Like when you see the piece of off of that thing, think you just like, you know, it's like it, it it it becomes rained. Instead of the correct. Like this should be something of the soul of the emotions. It shouldn't be something. I'd like the politics. Yes. It's like there is politics and all that stuff in both the root of it comes from the pack like a lack of acknowledgement. Write a lack of like respect than",0.9591389298439026,0 days 00:11:31.300000,0 days 00:12:05.300000,04/07/22,220407_003_me.wav
59," Yes, I would love to. I would love to. We could also go to the clothes, like, Diamond Bar has like shit, tons of like Asian restaurants. It's just like, if 98% even like this town, 20 minutes. All right. It's like that makes sense. Fast do that. You're flying out.",0.9401737451553345,0 days 00:12:06.400000,0 days 00:12:23.900000,04/07/22,220407_003_me.wav
60," Applebee's, okay. So what you did did she get like? Oh",0.8201366662979126,0 days 00:12:26.900000,0 days 00:12:31.600000,04/07/22,220407_003_me.wav
61, And can you pass me the smoothies?,0.5863850712776184,0 days 00:12:33,0 days 00:12:34.500000,04/07/22,220407_003_me.wav
62, That's walking good.,0.5654138922691345,0 days 00:12:37,0 days 00:12:38.300000,04/07/22,220407_003_me.wav
63, But Kate on wood.,0.5521546602249146,0 days 00:12:43.900000,0 days 00:12:45,04/07/22,220407_003_me.wav
64, Basildon figure.,0.4390742778778076,0 days 00:12:51.900000,0 days 00:12:53.200000,04/07/22,220407_003_me.wav
65, Where would a bubble?,0.4411402642726898,0 days 00:13:05.300000,0 days 00:13:06.300000,04/07/22,220407_003_me.wav
66, Has everyone Center applications that?,0.7091130018234253,0 days 00:13:11.700000,0 days 00:13:13.800000,04/07/22,220407_003_me.wav
67, I didn't get an email from her. Maybe she missed typing.,0.9009618759155273,0 days 00:13:14.900000,0 days 00:13:17.700000,04/07/22,220407_003_me.wav
68, It's also in the texts. Yeah.,0.966351330280304,0 days 00:13:18.900000,0 days 00:13:21.300000,04/07/22,220407_003_me.wav
69, And then they just need to attach like that. Most recent credit report and then that's it.,0.9206435680389404,0 days 00:13:22.400000,0 days 00:13:27.600000,04/07/22,220407_003_me.wav
70," Hey, hey.",0.893953800201416,0 days 00:17:21.300000,0 days 00:17:22.900000,04/07/22,220407_003_me.wav
71, Does tea tree oil in the bathroom.,0.9751042127609253,0 days 00:17:24,0 days 00:17:25.800000,04/07/22,220407_003_me.wav
72," Yeah, on the right.",0.9336936473846436,0 days 00:17:26.700000,0 days 00:17:27.800000,04/07/22,220407_003_me.wav
73, Songe.,0.3408336341381073,0 days 00:18:34.400000,0 days 00:18:35.500000,04/07/22,220407_003_me.wav
74, The depot with a bunt with the description already.,0.8274281620979309,0 days 00:18:36.900000,0 days 00:18:40.200000,04/07/22,220407_003_me.wav
75, Have you seen my?,0.822371780872345,0 days 00:22:16.200000,0 days 00:22:17.700000,04/07/22,220407_003_me.wav
76, This is an amazing. Fuck. I love this book. It's wonderful. You must read it and it's also a 50 pages.,0.9183439612388611,0 days 00:22:27.300000,0 days 00:22:36.300000,04/07/22,220407_003_me.wav
77, It's like super adorable and not makes it like even more beautiful somehow.,0.8590932488441467,0 days 00:22:37.500000,0 days 00:22:41.500000,04/07/22,220407_003_me.wav
78, Yeah.,0.8491751551628113,0 days 00:22:46.900000,0 days 00:22:48.300000,04/07/22,220407_003_me.wav
79, What time is it on 9:10 or we really have to go?,0.9309670329093933,0 days 00:22:56,0 days 00:23:00.200000,04/07/22,220407_003_me.wav
80," Hey girl, I just met you crazy. That's me. The other side identify most people.",0.9495468139648438,0 days 00:23:46.900000,0 days 00:23:53.900000,04/07/22,220407_003_me.wav
81, Is it thundering? Become like like hot and explode?,0.9070418477058411,0 days 00:23:58.400000,0 days 00:24:02,04/07/22,220407_003_me.wav
82," Iconic microcosms in macrocosm. So when you said, like, every it's awesome. I was always. I thought about let you know, but not just not just the things in the back. I mean, like Lich reality.",0.9161660075187683,0 days 00:24:05.900000,0 days 00:24:15.500000,04/07/22,220407_003_me.wav
83," We are all within shrimp, net.",0.7287806868553162,0 days 00:24:16.800000,0 days 00:24:18.500000,04/07/22,220407_003_me.wav
84," That's my daily existence. Oh, no problem of my life. Is that like it's Joy like learning a language and speaking in it at the same time in the states.",0.8954775333404541,0 days 00:24:21.100000,0 days 00:24:35.200000,04/07/22,220407_003_me.wav
85, Abdul Aziz Family Camp.,0.35530880093574524,0 days 00:24:43.800000,0 days 00:24:48.300000,04/07/22,220407_003_me.wav
86, So nice.,0.9751923084259033,0 days 00:24:52.400000,0 days 00:24:54.400000,04/07/22,220407_003_me.wav
87, Maybe right before getting arrested.,0.8936376571655273,0 days 00:25:05.200000,0 days 00:25:06.600000,04/07/22,220407_003_me.wav
88, Give me like one second.,0.6712024807929993,0 days 00:25:26.400000,0 days 00:25:27.800000,04/07/22,220407_003_me.wav
89," Hey, I just",0.9836282134056091,0 days 00:25:39.900000,0 days 00:25:41.300000,04/07/22,220407_003_me.wav
90, Get ready.,0.7641475200653076,0 days 00:26:38.800000,0 days 00:26:39.900000,04/07/22,220407_003_me.wav
91," I think I ate something. Oh, yeah, I love song. I love this shitt.",0.8177797198295593,0 days 00:26:40.900000,0 days 00:26:47.800000,04/07/22,220407_003_me.wav
92, Camila Cabello.,0.25567159056663513,0 days 00:26:53.300000,0 days 00:26:54.300000,04/07/22,220407_003_me.wav
93, Able to.,0.5567984580993652,0 days 00:26:56.200000,0 days 00:26:58.700000,04/07/22,220407_003_me.wav
94, I don't make love.,0.9340943098068237,0 days 00:27:13.600000,0 days 00:27:16,04/07/22,220407_003_me.wav
95," Guys, I am really excited.",0.9611650705337524,0 days 00:27:21.800000,0 days 00:27:23.600000,04/07/22,220407_003_me.wav
96, Punishment.,0.9258642792701721,0 days 00:27:41.300000,0 days 00:27:42.200000,04/07/22,220407_003_me.wav
97, It would be a little far.,0.8361597657203674,0 days 00:27:57.400000,0 days 00:27:58.900000,04/07/22,220407_003_me.wav
98, I can appreciate 40 minutes.,0.8213518857955933,0 days 00:27:59.700000,0 days 00:28:03.200000,04/07/22,220407_003_me.wav
99," K-Town, it should be like an hour and something new.",0.9063798189163208,0 days 00:28:04.300000,0 days 00:28:07.400000,04/07/22,220407_003_me.wav
100, Jiraiya.,0.5761560201644897,0 days 00:28:11.900000,0 days 00:28:12.700000,04/07/22,220407_003_me.wav
101, Cousin.,0.39009204506874084,0 days 00:28:13.600000,0 days 00:28:14.300000,04/07/22,220407_003_me.wav
102," but,",0.7861071228981018,0 days 00:28:26.200000,0 days 00:28:26.800000,04/07/22,220407_003_me.wav
103," Under the sweetest, boy. This wind going to be like this is definitely like half alcoholic content.",0.862975537776947,0 days 00:28:27.800000,0 days 00:28:37.200000,04/07/22,220407_003_me.wav
104," I kind of would be fine being like, in a reference.",0.8276996612548828,0 days 00:28:43.100000,0 days 00:28:45.500000,04/07/22,220407_003_me.wav
105, I think.,0.6241868734359741,0 days 00:29:00.400000,0 days 00:29:01.100000,04/07/22,220407_003_me.wav
106," I don't think, I don't think it's like, I think everything is about how you go about as as is I don't think it's problematic to go to like, London from",0.9329139590263367,0 days 00:29:10.300000,0 days 00:29:19.500000,04/07/22,220407_003_me.wav
107," Oh, it's not like that. Like like massive like mouth of people thronging to go, you know.",0.8743246793746948,0 days 00:29:20.800000,0 days 00:29:26.500000,04/07/22,220407_003_me.wav
108," Oh, that's there.",0.4142494201660156,0 days 00:29:28.900000,0 days 00:29:29.600000,04/07/22,220407_003_me.wav
109, Hey.,0.7967821955680847,0 days 00:29:41.300000,0 days 00:29:41.700000,04/07/22,220407_003_me.wav
110," hey, I'm so",0.9178471565246582,0 days 00:29:43.200000,0 days 00:29:44.100000,04/07/22,220407_003_me.wav
111, yeah.,0.8485360145568848,0 days 00:29:49.500000,0 days 00:29:49.800000,04/07/22,220407_003_me.wav
112, Master Wok.,0.39163732528686523,0 days 00:30:05.800000,0 days 00:30:06.600000,04/07/22,220407_003_me.wav
113, Motrin.,0.5304931402206421,0 days 00:30:14.800000,0 days 00:30:15.500000,04/07/22,220407_003_me.wav
114, I felt it probably means that you have like some some like them with some like a scab or something. If you like if you smell like all like they smoke.,0.9205542802810669,0 days 00:30:26.600000,0 days 00:30:40.700000,04/07/22,220407_003_me.wav
115, Purchase before maybe we have strong. Stronger boxes to get stronger over after while.,0.8606933951377869,0 days 00:30:42.800000,0 days 00:30:49.600000,04/07/22,220407_003_me.wav
116," do you like it's like,",0.6619025468826294,0 days 00:30:55.600000,0 days 00:30:58.400000,04/07/22,220407_003_me.wav
117," We'll probably go to the cats and leave. Ya stay in and I can buy a beautiful, but even I could ride the bus, like a month. It becomes like that, like, all the silent things like pasta and being set up like a Quay a Bigfoot. Look like, that's weird.",0.9177810549736023,0 days 00:31:00.500000,0 days 00:31:14.800000,04/07/22,220407_003_me.wav
118, Rosalina.,0.9702492952346802,0 days 00:31:26.700000,0 days 00:31:27.600000,04/07/22,220407_003_me.wav
119, It's really hot.,0.6734843254089355,0 days 00:32:07.500000,0 days 00:32:08.800000,04/07/22,220407_003_me.wav
120, Why?,0.8844337463378906,0 days 00:32:26.200000,0 days 00:32:26.600000,04/07/22,220407_003_me.wav
121, I believe.,0.8148432970046997,0 days 00:32:32.100000,0 days 00:32:32.600000,04/07/22,220407_003_me.wav
122, Everybody knows.,0.8087984323501587,0 days 00:36:56.800000,0 days 00:36:58.500000,04/07/22,220407_003_me.wav
123," I don't, I don't sure if my stomach can handle again. We said, Yeah, by Steve, but it's like I know.",0.8567553758621216,0 days 00:36:59.900000,0 days 00:37:05.600000,04/07/22,220407_003_me.wav
124," 5, believe I left that we have 13 arrive at that's enough to sit down and eat at Koreatown and get a burrito. I'm just thinking that if I'd be down to go, if we if we it depends on Priya Town thing takes the way back when we know.",0.9459312558174133,0 days 00:37:09.300000,0 days 00:37:27,04/07/22,220407_003_me.wav
125, This for the culture.,0.7873814702033997,0 days 00:37:42.300000,0 days 00:37:43.900000,04/07/22,220407_003_me.wav
126, Asian food.,0.5723660588264465,0 days 00:37:45.500000,0 days 00:37:46.400000,04/07/22,220407_003_me.wav
127, About to get on the flight. And you have like 15 minutes to smoke a Jay outside.,0.8108569979667664,0 days 00:37:50.800000,0 days 00:37:55.500000,04/07/22,220407_003_me.wav
128, I cross over a couple Lanes.,0.7960731387138367,0 days 00:38:05.700000,0 days 00:38:07.400000,04/07/22,220407_003_me.wav
129," I mean, it would be able to",0.8672273755073547,0 days 00:38:20.800000,0 days 00:38:24.500000,04/07/22,220407_003_me.wav
130," No, a light Eliza's like Auntie is like, oh that feels like a colored ones. You know what people have like a monochrome. Same like outfits wearing, you know riding these like a so imagine just like you",0.9299104809761047,0 days 00:38:27,0 days 00:38:39.600000,04/07/22,220407_003_me.wav
131, Rich Consultants on this Ducati.,0.912247359752655,0 days 00:38:40.500000,0 days 00:38:43.300000,04/07/22,220407_003_me.wav
132, Riding through the villages.,0.9719301462173462,0 days 00:38:46.800000,0 days 00:38:48.300000,04/07/22,220407_003_me.wav
133, Being held at the prophet.,0.7146152257919312,0 days 00:38:49.500000,0 days 00:38:51.100000,04/07/22,220407_003_me.wav
134, Yeah.,0.8486508727073669,0 days 00:38:53.300000,0 days 00:38:53.700000,04/07/22,220407_003_me.wav
135, I can't.,0.8300338983535767,0 days 00:38:55.200000,0 days 00:38:55.900000,04/07/22,220407_003_me.wav
136," probably has like,",0.8480980396270752,0 days 00:39:01.800000,0 days 00:39:02.600000,04/07/22,220407_003_me.wav
137, They need to show someone. I hope it. I hope High Plains.,0.7174623608589172,0 days 00:39:04.100000,0 days 00:39:10,04/07/22,220407_003_me.wav
138," I just saw an advertisement, that was insane. Drink almond milk, or you cannot and then I was like, not whole milk, but the knot was crossed out is like Pro milk at what spot chiaki?",0.9066258668899536,0 days 00:39:17.300000,0 days 00:39:31.100000,04/07/22,220407_003_me.wav
139," Try. I was like, fuck.",0.7849808931350708,0 days 00:39:36.500000,0 days 00:39:37.700000,04/07/22,220407_003_me.wav
140," I think you might be in between two ones though. Because if you look behind you, there's not space for like another parking. Like check to see what the parking space. Looks like a check it out.",0.9104963541030884,0 days 00:39:42.400000,0 days 00:39:53.500000,04/07/22,220407_003_me.wav
141," Babe, is it like do we need to put anything in?",0.9214074611663818,0 days 00:40:00,0 days 00:40:04.300000,04/07/22,220407_003_me.wav
142," Wait, I mean it might be like off the 8th or something. Could you and lied free parking?",0.8822975158691406,0 days 00:40:05.600000,0 days 00:40:10.900000,04/07/22,220407_003_me.wav
143," Coughing Masters folk, what you guys think?",0.7874324917793274,0 days 00:40:26,0 days 00:40:28.800000,04/07/22,220407_003_me.wav
144, Not that is impossible on guys.,0.763157069683075,0 days 00:40:35.300000,0 days 00:40:37.600000,04/07/22,220407_003_me.wav
145, Inline.,0.5699632167816162,0 days 00:40:51.800000,0 days 00:40:52.500000,04/07/22,220407_003_me.wav
146, I'm fine. I'm fine to pay at those who likes you. A choice.,0.841235876083374,0 days 00:41:35.500000,0 days 00:41:38.200000,04/07/22,220407_003_me.wav
147, Open now.,0.734764814376831,0 days 00:41:44.700000,0 days 00:41:46.100000,04/07/22,220407_003_me.wav
148, Is it by the garbage?,0.5748506188392639,0 days 00:41:57.400000,0 days 00:41:59.600000,04/07/22,220407_003_me.wav
149," Dwight, Dwight Eisenhower.",0.9785086512565613,0 days 00:42:23.900000,0 days 00:42:26.600000,04/07/22,220407_003_me.wav
150, I don't make love. I don't make love October.,0.9839594960212708,0 days 00:42:39.800000,0 days 00:42:44.400000,04/07/22,220407_003_me.wav
151, Would you?,0.946082353591919,0 days 00:42:46.900000,0 days 00:42:47.900000,04/07/22,220407_003_me.wav
152, Great Falls weather.,0.6135392189025879,0 days 00:42:56.300000,0 days 00:43:00.400000,04/07/22,220407_003_me.wav
153," Oh, yeah.",0.9538471698760986,0 days 00:43:32.600000,0 days 00:43:33.100000,04/07/22,220407_003_me.wav
154, I don't think.,0.9077648520469666,0 days 00:43:39,0 days 00:43:39.800000,04/07/22,220407_003_me.wav
155, Weather app.,0.7592780590057373,0 days 00:44:32.900000,0 days 00:44:37,04/07/22,220407_003_me.wav
156, I have that with any stuff like,0.7436906695365906,0 days 00:44:38.400000,0 days 00:44:41.900000,04/07/22,220407_003_me.wav
157," Iraq, I think I like this. I think I feel like that's a great Advocate. I will receive one.",0.8928949236869812,0 days 00:44:43,0 days 00:45:06.600000,04/07/22,220407_003_me.wav
158, remind me to put the,0.547996461391449,0 days 00:45:20.800000,0 days 00:45:23.900000,04/07/22,220407_003_me.wav
