,sentence,sentence_confidence,start_time,end_time,date,original_audio
131," But the thing is, is that the injured person, unless those things being pointed out. Just walking magnificent.",0.8656479120254517,0 days 00:27:03.700000,0 days 00:27:11.300000,03/16/22,220316_001_me.wav
132," It's crazy. I like Isaac don't, it doesn't become real.",0.8464075922966003,0 days 00:27:15,0 days 00:27:17.900000,03/16/22,220316_001_me.wav
133," That was the best one. That's when the most destructive things about like images and and TV and stuff like that is that it makes reality of the last real thing isn't that like I called, like really appreciate the beauty of the asthma because I've seen so many pictures they have to get rid of that shit.",0.9191938638687134,0 days 00:27:19.700000,0 days 00:27:45.500000,03/16/22,220316_001_me.wav
134, Shut the morally corrupt thing.,0.7221311330795288,0 days 00:27:47,0 days 00:27:48.900000,03/16/22,220316_001_me.wav
135, If I have enough water for.,0.667034387588501,0 days 00:27:56.300000,0 days 00:27:59.500000,03/16/22,220316_001_me.wav
136," Nothing. Really go to my old house and my, my glasses and my denada, like it to come so fluidly.",0.8728173971176147,0 days 00:28:07.800000,0 days 00:28:13.900000,03/16/22,220316_001_me.wav
137," Oh, nothing, pronounce. The Asian is largest in terms of like instinct.",0.6678915023803711,0 days 00:28:16.500000,0 days 00:28:20.400000,03/16/22,220316_001_me.wav
138, Hola.,0.7888404130935669,0 days 00:28:23.700000,0 days 00:28:24.200000,03/16/22,220316_001_me.wav
139," Yes, I can take a shower at 2 a.m.",0.47627025842666626,0 days 00:28:30.600000,0 days 00:28:36.900000,03/16/22,220316_001_me.wav
140," I think Americans X 10 days. That's what like makes the American accent that like,",0.9222478270530701,0 days 00:28:39.900000,0 days 00:28:45,03/16/22,220316_001_me.wav
141," What's up, my man? Everyone? What's up? What's up? What's good?",0.7274596691131592,0 days 00:28:50.200000,0 days 00:29:04.600000,03/16/22,220316_001_me.wav
142, Oh my God.,0.9515568614006042,0 days 00:29:09.200000,0 days 00:29:11.900000,03/16/22,220316_001_me.wav
143, That's my best and he is capable of more.,0.9069889783859253,0 days 00:29:15.400000,0 days 00:29:19.900000,03/16/22,220316_001_me.wav
144," But like wheel reflection, like I think because that was a lot of the things I do during the day is reflection, but it's not like, I'm just going over the same like few points in my mind and just out of the same few things, you know, in the same through worries.",0.9383983016014099,0 days 00:29:26.400000,0 days 00:29:52.300000,03/16/22,220316_001_me.wav
145," If it's a I'm going over the same few things over and over again, but it's really want to like the stomach drops and I thought like oh my God that's got squashed. And not like dropping of the floor of like realizing like oh shit. Like I've been bad, you know, I mean in the crew reflection,",0.9401939511299133,0 days 00:29:59.100000,0 days 00:30:24.100000,03/16/22,220316_001_me.wav
146, But there's I think there's a level before that.,0.8326632976531982,0 days 00:30:33,0 days 00:30:35.200000,03/16/22,220316_001_me.wav
147," Yeah, I know.",0.9645083546638489,0 days 00:30:42.200000,0 days 00:30:43,03/16/22,220316_001_me.wav
148, That's crazy.,0.9746623039245605,0 days 00:30:45,0 days 00:30:46.100000,03/16/22,220316_001_me.wav
149," I kind of like, giving up.",0.9606409072875977,0 days 00:30:48.400000,0 days 00:30:49.700000,03/16/22,220316_001_me.wav
150," Since I have is milk, no, I haven't given up but it's like it's like that possibility of like really knowing them. My brother's is really doing nothing partly because they don't know me and like they don't ask questions.",0.8897480964660645,0 days 00:30:51,0 days 00:31:04.800000,03/16/22,220316_001_me.wav
151," But Eric feel like they're still a window of a connection because he'd like to hear like, he's that both like extremely wide, they like don't have a lot of w, you know, unless those wasn't directed at like a specific idea, you know, if they do not have it it's like the entire process of communication happens. Like with the eyes with sort of like this where the South interactive it's going to be really easy. Interesting for you to see the family I come out of",0.9562907814979553,0 days 00:31:05.600000,0 days 00:31:37.500000,03/16/22,220316_001_me.wav
152," A warning about the house. I do not feel connected to that house in the slightest. English Gardens out front, you know, because like in a perfect, that's little",0.8985129594802856,0 days 00:31:40.700000,0 days 00:31:54.400000,03/16/22,220316_001_me.wav
153, Suburban House.,0.9818754196166992,0 days 00:31:55.500000,0 days 00:31:56.600000,03/16/22,220316_001_me.wav
154, The big Suburban House.,0.797663688659668,0 days 00:31:57.500000,0 days 00:31:59,03/16/22,220316_001_me.wav
155," You know, and it's just like does not feel like I like everyone feels uncomfortable in it. Yeah. Yes. I just uncomfortable with with a spirit of the place. You know, it's like no one really like, should be that dinner. I mean, no one really feels except maybe Eric cuz he's like, Ben",0.9258205890655518,0 days 00:32:00.800000,0 days 00:32:23,03/16/22,220316_001_me.wav
156, Like my parents like a like a teenager that's walk by the house. They just would have liked bury themselves in walk 24/7.,0.8998803496360779,0 days 00:32:24.500000,0 days 00:32:31.900000,03/16/22,220316_001_me.wav
157, No.,0.7842159867286682,0 days 00:32:33.900000,0 days 00:32:34.400000,03/16/22,220316_001_me.wav
158, Device.,0.8967041969299316,0 days 00:32:35.500000,0 days 00:32:36.200000,03/16/22,220316_001_me.wav
159," But he gave them all off. In pursuit of his dreams. I told you about the shit about him. He's like, he's like Justified isolating himself in his friends because he thinks everyone is telling everyone that stupid. Everyone is silly. It's like what I have.",0.9160832762718201,0 days 00:32:40.700000,0 days 00:32:57.100000,03/16/22,220316_001_me.wav
160, And woke up then.,0.8923833966255188,0 days 00:33:04,0 days 00:33:04.900000,03/16/22,220316_001_me.wav
161, Puetz golf.,0.7862484455108643,0 days 00:33:06.300000,0 days 00:33:06.900000,03/16/22,220316_001_me.wav
162, Re-read apostrophe.,0.8797775506973267,0 days 00:33:14.200000,0 days 00:33:15.500000,03/16/22,220316_001_me.wav
163, That was the password we found member.,0.8112441897392273,0 days 00:33:18.800000,0 days 00:33:20.500000,03/16/22,220316_001_me.wav
164," Not know. That was that rock that we stepped in and took a Hot Shots. We went down. So, yeah, that was it.",0.876264214515686,0 days 00:33:22.400000,0 days 00:33:28.600000,03/16/22,220316_001_me.wav
165, 100%.,0.9545179605484009,0 days 00:33:29.900000,0 days 00:33:30.600000,03/16/22,220316_001_me.wav
166," No, just coming from the other direction.",0.8561779856681824,0 days 00:33:35,0 days 00:33:36.300000,03/16/22,220316_001_me.wav
167, But like what? What do you think about you or your sister?,0.9361851811408997,0 days 00:33:42.900000,0 days 00:33:45.700000,03/16/22,220316_001_me.wav
168, Why do you think that you don't know how?,0.9401381611824036,0 days 00:33:47.400000,0 days 00:33:49,03/16/22,220316_001_me.wav
169, Zooplus like each other.,0.7401019930839539,0 days 00:34:07.400000,0 days 00:34:10.600000,03/16/22,220316_001_me.wav
170, Choose a different major. What's a major?,0.8352259993553162,0 days 00:34:11.500000,0 days 00:34:14.400000,03/16/22,220316_001_me.wav
171, High School.,0.6373637914657593,0 days 00:34:18.400000,0 days 00:34:19,03/16/22,220316_001_me.wav
172, I really don't care if she's 4 hours.,0.7245356440544128,0 days 00:34:23.700000,0 days 00:34:25.600000,03/16/22,220316_001_me.wav
173, Plastic.,0.633202314376831,0 days 00:34:26.800000,0 days 00:34:27.800000,03/16/22,220316_001_me.wav
174," yeah, I know, but was high like, reason for like",0.8764508962631226,0 days 00:34:37.500000,0 days 00:34:39.700000,03/16/22,220316_001_me.wav
175, K. I z. I,0.7428977489471436,0 days 00:34:46.200000,0 days 00:34:49.200000,03/16/22,220316_001_me.wav
176, Also is respite.,0.5856687426567078,0 days 00:34:57.400000,0 days 00:34:58.500000,03/16/22,220316_001_me.wav
177, Kind of kind of a dead person.,0.6772101521492004,0 days 00:34:59.500000,0 days 00:35:00.900000,03/16/22,220316_001_me.wav
178," Haley says, it's okay for me to say that.",0.9208993911743164,0 days 00:35:04.200000,0 days 00:35:05.900000,03/16/22,220316_001_me.wav
179, Is it bad to? Is it bad to?,0.9726521372795105,0 days 00:35:07.300000,0 days 00:35:09.500000,03/16/22,220316_001_me.wav
180," Well, that's cuz it's the thing is.",0.6105986833572388,0 days 00:35:14.200000,0 days 00:35:16.700000,03/16/22,220316_001_me.wav
181, What song is this?,0.4724826514720917,0 days 00:35:18.300000,0 days 00:35:19.900000,03/16/22,220316_001_me.wav
182, I know.,0.9037196636199951,0 days 00:35:34.500000,0 days 00:35:35.300000,03/16/22,220316_001_me.wav
183," Hey, I'm in takes a while. Hey, hey.",0.7979512810707092,0 days 00:35:39.100000,0 days 00:35:42.200000,03/16/22,220316_001_me.wav
184, You been?,0.7291203737258911,0 days 00:35:45.300000,0 days 00:35:45.900000,03/16/22,220316_001_me.wav
185, Feel.,0.24957719445228577,0 days 00:36:02.700000,0 days 00:36:03.500000,03/16/22,220316_001_me.wav
186," Yeah, that's fantastic. The one the best things I have.",0.9100521206855774,0 days 00:36:05.500000,0 days 00:36:08.300000,03/16/22,220316_001_me.wav
187," Yeah, I know.",0.9774605631828308,0 days 00:36:10,0 days 00:36:10.800000,03/16/22,220316_001_me.wav
188," Okay, really?",0.9699201583862305,0 days 00:36:12.700000,0 days 00:36:14.600000,03/16/22,220316_001_me.wav
189," And bust everywhere. I think that's why the communication between my ass cheeks. Look like make it like you said, she is falling.",0.9008663892745972,0 days 00:36:19.300000,0 days 00:36:25.600000,03/16/22,220316_001_me.wav
190, Well then.,0.790724515914917,0 days 00:36:31.500000,0 days 00:36:32.100000,03/16/22,220316_001_me.wav
191, Woo.,0.36884480714797974,0 days 00:36:37.200000,0 days 00:36:37.600000,03/16/22,220316_001_me.wav
192," Yeah, we've been walking for a while.",0.9467669129371643,0 days 00:36:39.300000,0 days 00:36:40.800000,03/16/22,220316_001_me.wav
193," Yeah, we have to work out for a bit across this mountain. And then",0.9618073105812073,0 days 00:36:45.200000,0 days 00:36:49.700000,03/16/22,220316_001_me.wav
194, I feel really good. Getting out. My stomach is like growling poking takes my mind off of it.,0.963527262210846,0 days 00:36:51.400000,0 days 00:36:58.500000,03/16/22,220316_001_me.wav
195," like,",0.9480042457580566,0 days 00:37:04.500000,0 days 00:37:04.900000,03/16/22,220316_001_me.wav
196, Like what?,0.9755005836486816,0 days 00:37:06.400000,0 days 00:37:07.100000,03/16/22,220316_001_me.wav
197, What is nothing?,0.7275792956352234,0 days 00:37:32.800000,0 days 00:37:40.200000,03/16/22,220316_001_me.wav
198, What you mean?,0.947037398815155,0 days 00:37:51.400000,0 days 00:37:52,03/16/22,220316_001_me.wav
199," Like, what age?",0.9702962040901184,0 days 00:37:53.600000,0 days 00:37:54.500000,03/16/22,220316_001_me.wav
200," Wolves in the walls in the walls, in the walls. That's like my favorite fucking picture, but I was at Nexus haunting fucking but",0.8714390397071838,0 days 00:37:56.400000,0 days 00:38:11.600000,03/16/22,220316_001_me.wav
201," Homes and fucking book. It was about these on the drawing salve is when was like 10 bucks in like a little like this. Yeah. I know, but it was like a little bit of like talking wolves, that would like living in the walls of this big old house, you know? And all they wanted to do with eat John, you know, one day. So it's like the Wolves came, like, came out an angel, the human damn. You just be a gross of all my God, we've crossed it.",0.9329054951667786,0 days 00:38:13.400000,0 days 00:39:04,03/16/22,220316_001_me.wav
202," Yeah, I know but like I was that was one of the books in.",0.926468014717102,0 days 00:39:04.800000,0 days 00:39:11.200000,03/16/22,220316_001_me.wav
203," A woman, big white things with big noses.",0.9459517002105713,0 days 00:39:15.800000,0 days 00:39:18.700000,03/16/22,220316_001_me.wav
204, Not to like it.,0.7062023878097534,0 days 00:39:22.800000,0 days 00:39:23.800000,03/16/22,220316_001_me.wav
205," But to I'm thinking that like human human thing, is that like totally the imagination of this crazy. Yeah, I know, but it was a crazy finish, like, a Swedish finish, floors like lived alone. And how does like, Power by the Sea, you know, I'm just like, Road just ignore Miss amounts and it's like the most, like beautiful. It's are so beautiful. I love you, man. And",0.9363227486610413,0 days 00:39:24.700000,0 days 00:39:53.700000,03/16/22,220316_001_me.wav
206, Most of all trolls songs.,0.5595523715019226,0 days 00:39:55.600000,0 days 00:39:56.800000,03/16/22,220316_001_me.wav
207," Lots of small things like Illustrated Illustrated issue illustrate. This, a beautiful Lake. Charles dog has a little bit of Darkness like about them.",0.8876308798789978,0 days 00:40:02.800000,0 days 00:40:18,03/16/22,220316_001_me.wav
208," You know, I miss the mystery, you know.",0.8051441311836243,0 days 00:40:19.200000,0 days 00:40:21,03/16/22,220316_001_me.wav
209," Yeah, and that was like, it was like wonderful. I don't see things like missed, like a little bit scary as well. But like, he missed itself is the most I can do is 100. Like that shit. Is the stuff of imagination. Yeah, exactly.",0.9384006261825562,0 days 00:40:23.600000,0 days 00:40:38.800000,03/16/22,220316_001_me.wav
210," Hundred percent music, real quick. And then you're like, a little kid, is just as I dreaming, that little guy and I think I became a little bit of everything was a blocked. I've lost a lot of my memory, my childhood. Like the thing is, I have many more memories from that farm house, even though we spent fractions by fractions of my childhood that good things almost all of my memories like storming the walls, you know, it's told in a store next door in like a little moments and memories that come back to you and some kind of",0.9550269842147827,0 days 00:40:39.600000,0 days 00:41:21.200000,03/16/22,220316_001_me.wav
211," I know the thing is, it's not like it's fine. If you still have a mental picture of the house or home that you lived in when you were a child.",0.9444006085395813,0 days 00:41:23.300000,0 days 00:41:29.200000,03/16/22,220316_001_me.wav
212," You know, when you have like it, if you stayed that long enough to have liked it, even if you sell it, then, you know, you will retain those memories because you have like a butt like my environment changed every couple of months. You know what I mean. Like I never liked had and I know it have a representation of like my childhood so does like, I don't know what it looks like on the seven years.",0.9371747374534607,0 days 00:41:33.900000,0 days 00:41:54.600000,03/16/22,220316_001_me.wav
213," Kids born in, in London.",0.846019446849823,0 days 00:41:55.700000,0 days 00:41:57.600000,03/16/22,220316_001_me.wav
214," No, not really. I mean, no, not really. He's totally different.",0.9776899814605713,0 days 00:41:58.800000,0 days 00:42:03,03/16/22,220316_001_me.wav
215," But I like, I like don't have memories from where I left. I don't have like a house memories. When I was a child. I do have anything cuz I do have so many memories attached to sort of The Farmhouse, you know, but I have none.",0.9271124005317688,0 days 00:42:04.400000,0 days 00:42:20.300000,03/16/22,220316_001_me.wav
216," Also this just I told him that you know, because like I never I never liked my mind was just always moving, you know, and because of that I never really",0.868611752986908,0 days 00:42:24.600000,0 days 00:42:35.600000,03/16/22,220316_001_me.wav
217," Yeah, I know. I did not have the house like a quiet kid like my brother, you know.",0.9164046049118042,0 days 00:42:37.700000,0 days 00:42:43.800000,03/16/22,220316_001_me.wav
218," You know, my dad was relating a story about like when I was a kid that, you know, to me, I don't know if I told you already.",0.910765528678894,0 days 00:42:45.500000,0 days 00:42:50.700000,03/16/22,220316_001_me.wav
219," not like we were like sitting in like,",0.8063254356384277,0 days 00:42:52.200000,0 days 00:42:53.900000,03/16/22,220316_001_me.wav
220," Nothing just like house. I know by the nebulous name my sunrise and like we were sitting amongst boxes. It was like the many, many time we moved to get out. And my brother took me and put me in the center of the room and was like, okay. So here's how it like his. Help. Take the five things that you love the most in and put them in this bag.",0.9542075395584106,0 days 00:42:54.800000,0 days 00:43:24.900000,03/16/22,220316_001_me.wav
221," I like the fact that that was like the 8th or something, you know, of the time it was.",0.7821834087371826,0 days 00:43:36.900000,0 days 00:43:41.700000,03/16/22,220316_001_me.wav
222, Real communication.,0.7185767889022827,0 days 00:43:44.600000,0 days 00:43:45.500000,03/16/22,220316_001_me.wav
223," Oh, really all the past smashed or is it? Okay, that's fine.",0.8365573287010193,0 days 00:43:51.600000,0 days 00:43:56.300000,03/16/22,220316_001_me.wav
224, Everything. So. Do you like pad juices profitable?,0.6695265173912048,0 days 00:44:08.100000,0 days 00:44:11.200000,03/16/22,220316_001_me.wav
225," Yes, I want to see like I don't remember. I don't like it. I don't have like any memories and then",0.8685828447341919,0 days 00:44:14.200000,0 days 00:44:19.800000,03/16/22,220316_001_me.wav
226," Valley NE like I have like a couple of snapshots. That's it. I'm like kind of obsessed with memory now, you know.",0.9138874411582947,0 days 00:44:20.900000,0 days 00:44:31.700000,03/16/22,220316_001_me.wav
227," And once you like really loves, you, like truly forgotten something it's gone, you know, it's going to everyone.",0.8839109539985657,0 days 00:44:32.600000,0 days 00:44:38.900000,03/16/22,220316_001_me.wav
228," Oh, yeah.",0.9624960422515869,0 days 00:44:39.800000,0 days 00:44:40.400000,03/16/22,220316_001_me.wav
229," I know, which is why I like that, like, that sense of like, Universal, like it wisdom that I feel like I'm partly off the, you know, in like in life, like I want to be like by an old man. I want to be able to have like, read some like a disposal Apex level of sodas like knowledge of myself, at least, you know, I mean, old people do. That's not a part of. The reason of this project is that I can I can, you know,",0.9290086627006531,0 days 00:44:43.200000,0 days 00:45:12.500000,03/16/22,220316_001_me.wav
230," Yeah, John links how important is a big downside of this.",0.7219123244285583,0 days 00:45:15.800000,0 days 00:45:21,03/16/22,220316_001_me.wav
231," Yeah, it is a mega jungle.",0.8150603771209717,0 days 00:45:23.200000,0 days 00:45:24.400000,03/16/22,220316_001_me.wav
232," He was really angry. I lost like months of recording because of that, this life of quarter. I had it by the belt comes out like every single time. It was like going like banging, know it like a bang. That's why I like it. You can't hear anything in the recordings.",0.9072979688644409,0 days 00:45:25.700000,0 days 00:45:42.500000,03/16/22,220316_001_me.wav
233," So, you can only hear if it if I'm sitting down. So, I have to, like, go out and like, take out all of the movements, all the moving recording. Wait, wait, wait, wait.",0.9072912335395813,0 days 00:45:43.400000,0 days 00:45:59.700000,03/16/22,220316_001_me.wav
234, Is that the top go back?,0.8852382302284241,0 days 00:46:05.700000,0 days 00:46:07.600000,03/16/22,220316_001_me.wav
235, Play the princess.,0.7069230675697327,0 days 00:46:14.800000,0 days 00:46:15.600000,03/16/22,220316_001_me.wav
236, Just like when the speed of a m o s e.,0.7824587225914001,0 days 00:46:19.800000,0 days 00:46:23,03/16/22,220316_001_me.wav
237, Cuz the song is like an Illuminating them.,0.7448083758354187,0 days 00:46:27.600000,0 days 00:46:29.600000,03/16/22,220316_001_me.wav
238, Everything looks so blue.,0.9506551027297974,0 days 00:46:31.500000,0 days 00:46:33.200000,03/16/22,220316_001_me.wav
239," went to school, just hold the",0.7695208191871643,0 days 00:46:39.500000,0 days 00:46:40.900000,03/16/22,220316_001_me.wav
240, Hope my phone's doing here.,0.6082353591918945,0 days 00:46:46.300000,0 days 00:46:47.400000,03/16/22,220316_001_me.wav
241, Oh my God.,0.9465406537055969,0 days 00:46:49.500000,0 days 00:46:50.400000,03/16/22,220316_001_me.wav
242, Baxley transpose mashup.,0.7412042617797852,0 days 00:47:02.900000,0 days 00:47:04.600000,03/16/22,220316_001_me.wav
243, 12.,0.9437456130981445,0 days 00:47:12,0 days 00:47:12.600000,03/16/22,220316_001_me.wav
244," Magnificent. Hey, I'm going to get the last thing. I'm going to get this done and disposable camera. This is like one for the ages.",0.8723544478416443,0 days 00:47:18.500000,0 days 00:47:26.900000,03/16/22,220316_001_me.wav
245, How do we do this?,0.9502171277999878,0 days 00:47:32,0 days 00:47:32.800000,03/16/22,220316_001_me.wav
246," I'm going to get one. I want one of me. See if I can leave. Okay, I want it like that.",0.9439047574996948,0 days 00:47:35.900000,0 days 00:47:42.200000,03/16/22,220316_001_me.wav
247, Hold it steady and then we have to like to move it back a little bit once I got it.,0.9260064363479614,0 days 00:47:43.800000,0 days 00:47:50.400000,03/16/22,220316_001_me.wav
248," Okay, I think we got it.",0.9635376334190369,0 days 00:47:54.800000,0 days 00:47:56.200000,03/16/22,220316_001_me.wav
249, We got it.,0.739815890789032,0 days 00:47:58.300000,0 days 00:47:59.100000,03/16/22,220316_001_me.wav
250," Well, that's a beat the big fucking Bob. Holy shit. That's a big. But only one more selfie.",0.8093973398208618,0 days 00:48:00.600000,0 days 00:48:15.300000,03/16/22,220316_001_me.wav
251, No place to set.,0.7288144826889038,0 days 00:48:22.600000,0 days 00:48:23.800000,03/16/22,220316_001_me.wav
252, They also have to take measurements.,0.6632501482963562,0 days 00:48:26.900000,0 days 00:48:28.200000,03/16/22,220316_001_me.wav
253, I just want a real picture. You going to get yourself?,0.9123041033744812,0 days 00:48:29.500000,0 days 00:48:32.400000,03/16/22,220316_001_me.wav
254, Oh wait. Can you just like after they come?,0.8545435667037964,0 days 00:48:35.500000,0 days 00:48:37.600000,03/16/22,220316_001_me.wav
255, Would you take a picture of us with the with the background where you want them here?,0.7577617764472961,0 days 00:48:46.700000,0 days 00:48:52.900000,03/16/22,220316_001_me.wav
256, Cute. Thank you so much.,0.7845276594161987,0 days 00:48:56.300000,0 days 00:48:58.700000,03/16/22,220316_001_me.wav
257, That's it. Like doesn't like I don't know how to fit this shit in. Let me see.,0.7853935360908508,0 days 00:49:04.300000,0 days 00:49:09.300000,03/16/22,220316_001_me.wav
258, My passport.,0.7741836905479431,0 days 00:49:17.400000,0 days 00:49:19.200000,03/16/22,220316_001_me.wav
259, China.,0.6284205317497253,0 days 00:49:20.700000,0 days 00:49:21.900000,03/16/22,220316_001_me.wav
260," Okay, it's like kind of weird. Yeah, I'll do that.",0.9667874574661255,0 days 00:49:23,0 days 00:49:27.300000,03/16/22,220316_001_me.wav
261, It's mohawk.,0.7618443965911865,0 days 00:49:39.900000,0 days 00:49:41,03/16/22,220316_001_me.wav
262," Yeah, just working out the house. Then.",0.8842440843582153,0 days 00:49:51.100000,0 days 00:49:52.800000,03/16/22,220316_001_me.wav
263, Good. Yeah.,0.9392461776733398,0 days 00:49:54.300000,0 days 00:49:56.200000,03/16/22,220316_001_me.wav
264, What the old man like the old guy with the beard?,0.869167685508728,0 days 00:50:01.900000,0 days 00:50:07.400000,03/16/22,220316_001_me.wav
265, I think like the white has a white bear looks. So cool. Looks so cool to have the white hair in the white beard.,0.9048673510551453,0 days 00:50:13.400000,0 days 00:50:18.100000,03/16/22,220316_001_me.wav
266, Hola.,0.29848653078079224,0 days 00:50:29.100000,0 days 00:50:29.600000,03/16/22,220316_001_me.wav
267," I said the nice place in town, at least for one night.",0.852753221988678,0 days 00:50:33.200000,0 days 00:50:37,03/16/22,220316_001_me.wav
268, Yeah.,0.7844741344451904,0 days 00:50:39.300000,0 days 00:50:39.700000,03/16/22,220316_001_me.wav
269, I think they will.,0.9682763814926147,0 days 00:50:42.900000,0 days 00:50:44.800000,03/16/22,220316_001_me.wav
270, But we still got that soon.,0.8634519577026367,0 days 00:50:46.300000,0 days 00:50:47.700000,03/16/22,220316_001_me.wav
271, Thank you.,0.9614259004592896,0 days 00:51:02.200000,0 days 00:51:02.900000,03/16/22,220316_001_me.wav
272, I love this.,0.958885669708252,0 days 00:51:22.800000,0 days 00:51:25.300000,03/16/22,220316_001_me.wav
273, Vulcan gorgeous.,0.8059136867523193,0 days 00:51:29,0 days 00:51:30.700000,03/16/22,220316_001_me.wav
274, I think seen that massive by that. I think that was enough. I might have been enough prey and also,0.8083252906799316,0 days 00:51:32.900000,0 days 00:51:37.900000,03/16/22,220316_001_me.wav
275," Is that what it says? Oh my God. I know we are doing well. We got some sleep. I just, I guess it's downhill.",0.8784034848213196,0 days 00:51:45.200000,0 days 00:51:58.300000,03/16/22,220316_001_me.wav
276," When would why is it so much quicker? Also, I long for that ending like I'm going.",0.8525245785713196,0 days 00:52:00.100000,0 days 00:52:06.200000,03/16/22,220316_001_me.wav
277," This hike was back. I was dreaming about it. Oh my God, I think a little bit drunk of one band. Yes. I know.",0.8811910152435303,0 days 00:52:09.400000,0 days 00:52:24.300000,03/16/22,220316_001_me.wav
278," Yeah, that be is going to get us Tipsy as fuck. Hello.",0.8803913593292236,0 days 00:52:25.100000,0 days 00:52:29.400000,03/16/22,220316_001_me.wav
279, I didn't see the last one.,0.938495934009552,0 days 00:52:40.700000,0 days 00:52:41.700000,03/16/22,220316_001_me.wav
