,sentence,sentence_confidence,start_time,end_time,date,original_audio
132, I have some pretty with lovely walks with recently.,0.8392273783683777,0 days 00:31:01.300000,0 days 00:31:07.200000,05/20/21,210520_003_me.wav
133, I love how we just completely escaped.,0.9821956753730774,0 days 00:31:08.800000,0 days 00:31:10.900000,05/20/21,210520_003_me.wav
134, Your parents know. Okay. I do not want to be mad.,0.8206775784492493,0 days 00:31:13.400000,0 days 00:31:20.400000,05/20/21,210520_003_me.wav
135, Will do.,0.9633272886276245,0 days 00:31:29.100000,0 days 00:31:29.800000,05/20/21,210520_003_me.wav
136, Capricious.,0.5528945326805115,0 days 00:31:34.200000,0 days 00:31:34.800000,05/20/21,210520_003_me.wav
137, I feel like I'm home.,0.8323545455932617,0 days 00:31:50.800000,0 days 00:31:52.300000,05/20/21,210520_003_me.wav
138," No, I I I think I like like you guys can like a poke and critique a little more and do things like that. But it's the same thing in the same like, you know.",0.9338197708129883,0 days 00:31:55.900000,0 days 00:32:09.100000,05/20/21,210520_003_me.wav
139, I couldn't make fun of somebody.,0.8317320346832275,0 days 00:32:10.600000,0 days 00:32:14.500000,05/20/21,210520_003_me.wav
140," If I don't, then I'm just going to not be saying anything. I have no sense of",0.9749169945716858,0 days 00:32:21.400000,0 days 00:32:24.500000,05/20/21,210520_003_me.wav
141," Oh my. Yes, you can be mean.",0.8486709594726562,0 days 00:32:28,0 days 00:32:29.400000,05/20/21,210520_003_me.wav
142," I don't even know what color I just, I just like weird, like the currently out.",0.8964794278144836,0 days 00:32:36.700000,0 days 00:32:53.500000,05/20/21,210520_003_me.wav
143, Maybe we should do that sometime this weekend.,0.9677760004997253,0 days 00:32:54.800000,0 days 00:32:58.100000,05/20/21,210520_003_me.wav
144," Yeah, like how it sounds is jamming friend. Who came?",0.852241039276123,0 days 00:33:03.200000,0 days 00:33:07.700000,05/20/21,210520_003_me.wav
145, Really?,0.9512649178504944,0 days 00:33:09.300000,0 days 00:33:09.900000,05/20/21,210520_003_me.wav
146," I'd like the friendship with him went skiing with him. Once he was just in the ski resorts. What kind of? Yeah, well, Swedish and so we like what? We like, whatever we smoked.",0.9011924862861633,0 days 00:33:14.400000,0 days 00:33:31.200000,05/20/21,210520_003_me.wav
147," How much are was nice to like, in people like a good if you would like?",0.7788620591163635,0 days 00:33:33.200000,0 days 00:33:37.400000,05/20/21,210520_003_me.wav
148, I'm not sure. I'm not sure who.,0.9233766198158264,0 days 00:33:39.600000,0 days 00:33:40.900000,05/20/21,210520_003_me.wav
149, What was that? I've done. You know how it was. I was just that he doesn't like,0.7160757184028625,0 days 00:33:42.800000,0 days 00:33:51,05/20/21,210520_003_me.wav
150," Yeah, it sucks.",0.9373456835746765,0 days 00:33:53.800000,0 days 00:33:54.600000,05/20/21,210520_003_me.wav
151," Yeah, so far. The studies show. No.",0.9468880295753479,0 days 00:33:57.100000,0 days 00:34:01.300000,05/20/21,210520_003_me.wav
152," Are they fit like not the Tobacco on these are just asking but I put one up and just like it was like my entire mouth was just like pulsating. I just couldn't is kind of like the icon, like I like how it felt to.",0.9054762125015259,0 days 00:34:04.400000,0 days 00:34:19,05/20/21,210520_003_me.wav
153, Continent that wants to try it.,0.8183667063713074,0 days 00:34:31.300000,0 days 00:34:33.400000,05/20/21,210520_003_me.wav
154, I've tried so you know that it just it just feels really weird.,0.7218888998031616,0 days 00:34:33.900000,0 days 00:34:39.500000,05/20/21,210520_003_me.wav
155, Either.,0.5556123852729797,0 days 00:34:45.800000,0 days 00:34:48.300000,05/20/21,210520_003_me.wav
156," Like I care if you want to just like that, and then just closing up. Soon as blacks.",0.8156940340995789,0 days 00:34:49.100000,0 days 00:34:55.200000,05/20/21,210520_003_me.wav
157, Separate hair will like up that some people like putting it like in the back of my gums like that.,0.8119497299194336,0 days 00:34:56.300000,0 days 00:35:01,05/20/21,210520_003_me.wav
158, Really?,0.8395503163337708,0 days 00:35:02.400000,0 days 00:35:02.900000,05/20/21,210520_003_me.wav
159, Does Emily have any connection?,0.7944708466529846,0 days 00:35:19.200000,0 days 00:35:23.700000,05/20/21,210520_003_me.wav
160, Eventually.,0.9715020060539246,0 days 00:35:24.800000,0 days 00:35:26,05/20/21,210520_003_me.wav
161," have it in for a little bit, and then we'll see, like",0.8633079528808594,0 days 00:35:31.900000,0 days 00:35:35.400000,05/20/21,210520_003_me.wav
162, When if I retry it?,0.7167658805847168,0 days 00:35:36.200000,0 days 00:35:40.600000,05/20/21,210520_003_me.wav
163, I'll give it a tablet on this and I did it once in Sweden like a very sweet. This news is a tobacco and you got some gum gum original one as much as I can.,0.8800582885742188,0 days 00:35:42.800000,0 days 00:36:08.100000,05/20/21,210520_003_me.wav
164," Redistricting what is real? Right. That's how I feel about it, but I kept it off.",0.7549238204956055,0 days 00:36:09.200000,0 days 00:36:21.800000,05/20/21,210520_003_me.wav
165, It feels weird.,0.9510547518730164,0 days 00:36:25.600000,0 days 00:36:26.400000,05/20/21,210520_003_me.wav
166, The other thing this country to keep on eating and drinking.,0.642213761806488,0 days 00:36:27.800000,0 days 00:36:30.500000,05/20/21,210520_003_me.wav
167," You can send stuff to say. It's so nice. Just having coffee in the sink. I feel like I just feel like I can't as much as like, as much as anything ruin. So, you know.",0.9382899403572083,0 days 00:36:33.300000,0 days 00:36:50.200000,05/20/21,210520_003_me.wav
168, Not know.,0.7435306310653687,0 days 00:36:50.600000,0 days 00:36:52.600000,05/20/21,210520_003_me.wav
169, Will you be here for my birthday?,0.8180890083312988,0 days 00:36:59.800000,0 days 00:37:00.800000,05/20/21,210520_003_me.wav
170, How long you here me to pretty much?,0.8359205722808838,0 days 00:37:02.900000,0 days 00:37:08,05/20/21,210520_003_me.wav
171," Like we never went outside anything. We should do that more, but we should do what we can.",0.869939923286438,0 days 00:37:14.800000,0 days 00:37:22,05/20/21,210520_003_me.wav
172, What's like what's like Emily Latin?,0.7122463583946228,0 days 00:37:24.200000,0 days 00:37:26.500000,05/20/21,210520_003_me.wav
173," I would love to meet some but like like I lost you but like what was your point of connection? Like, Howard the deal?",0.8864409923553467,0 days 00:37:29.900000,0 days 00:37:38.700000,05/20/21,210520_003_me.wav
174, I don't know.,0.9641696810722351,0 days 00:37:40,0 days 00:37:40.700000,05/20/21,210520_003_me.wav
175," Random shit said, buys it.",0.6264684200286865,0 days 00:37:41.600000,0 days 00:37:43.900000,05/20/21,210520_003_me.wav
176," A conversation, like one of my friends, like it, when we hang out with them to get together for one last time to see you kind of liked trained to me a little better. I think, when I know when I'm around you, I definitely",0.8640717267990112,0 days 00:37:48.500000,0 days 00:38:07.100000,05/20/21,210520_003_me.wav
177, Lower.,0.6552576422691345,0 days 00:38:09.300000,0 days 00:38:10.600000,05/20/21,210520_003_me.wav
178," The problem is that sometimes but sometimes it just right. I mean, people like talk about calling shows that you watch and you talk about shows, like I feel like it's on fast, like just biased, just one particular, full move media, and then just like, if like, see if someone's read it and then it's like no one talks about it.",0.9340264201164246,0 days 00:38:20.200000,0 days 00:38:47.200000,05/20/21,210520_003_me.wav
179, I'll talk to you about.,0.8381003141403198,0 days 00:38:47.700000,0 days 00:38:48.500000,05/20/21,210520_003_me.wav
180," I feel like that's what kind of wonderful. See what wonderful about TV is that you have liked it. I feel like you can in the face with a, at many different levels, you know, like, you can, you can come in but like, I can think about it. You can come in from like a very, very plain. What Ivan got out wherever you want to go. You can get them, just funny that you can get up with normal set. You can get it like me for set. Most of the time, the TV has, all of it inside of it, you know.",0.9380301237106323,0 days 00:38:50.700000,0 days 00:39:15.900000,05/20/21,210520_003_me.wav
181, I think sometimes it does.,0.927531361579895,0 days 00:39:21.200000,0 days 00:39:22.600000,05/20/21,210520_003_me.wav
182," Do I also like I don't like when it's when it devolves to just reference, but I like when people try to like a ticket at things and try to look at it like that. So that feelings and stuff in different ways and then just like quoting shit that people have said, you know, like just trying to pass through Foucault again, will I could not know about food, I mean, about you, I say,",0.9178043007850647,0 days 00:39:25,0 days 00:39:43.400000,05/20/21,210520_003_me.wav
183, Reading fuuka.,0.4352469742298126,0 days 00:39:45.700000,0 days 00:39:46.600000,05/20/21,210520_003_me.wav
184, I don't do I like fruit but it's different. It's like in your only point in conversation is just like talking about someone else's idea that's there.,0.821388304233551,0 days 00:39:47.700000,0 days 00:39:57,05/20/21,210520_003_me.wav
185, Great French.,0.6521430015563965,0 days 00:39:57.500000,0 days 00:39:58,05/20/21,210520_003_me.wav
186," I heard about that. But before she got fired, the transformative experience.",0.8054417967796326,0 days 00:39:58.600000,0 days 00:40:12.700000,05/20/21,210520_003_me.wav
187," Like for what? Just of all time, great experience.",0.7607895135879517,0 days 00:40:22.700000,0 days 00:40:25.700000,05/20/21,210520_003_me.wav
188," Like, I didn't trust 3.5 G.",0.6832914352416992,0 days 00:40:28,0 days 00:40:31.400000,05/20/21,210520_003_me.wav
189, Visuals.,0.30633336305618286,0 days 00:40:33.500000,0 days 00:40:34.400000,05/20/21,210520_003_me.wav
190, How to get?,0.5297194719314575,0 days 00:40:39.100000,0 days 00:40:39.700000,05/20/21,210520_003_me.wav
191," Would you like scabs of like stuff that's not strong? Cuz I'm like not sure of what is that? She doing too bad. That's like, you know as a with weed. I feel like you have some kind of like Baseline.",0.9372521638870239,0 days 00:40:45.200000,0 days 00:40:55.500000,05/20/21,210520_003_me.wav
192, Yeah.,0.24697227776050568,0 days 00:41:00.300000,0 days 00:41:00.700000,05/20/21,210520_003_me.wav
193," You know, that Abbot would like justice. I didn't feel like I was like, the major pothead. I'm like, I'm always like inside during dinner was, was was very. He was talking about how like people like me and would like I feel like I'm always like extremely strong and I'm always liked very much pursuing something I like.",0.9473351836204529,0 days 00:41:02.600000,0 days 00:41:24,05/20/21,210520_003_me.wav
194," Yeah, he's at home. So I'm sexy girl off of the time. Like it makes me like she'll actually like I'm not slow down to us a much more of this. I can relate to people. I don't have to, like, I don't have to talk. I can just to like be the end. Something that like, it's something, it's like, I think we'd it's been a bit, like a great liked, it was a great teacher for a while, you know, in like a really going down to after the other. That's why I really liked it. Cuz it could have contracted some of that. The abrasive sides of of me, anything it told me to be much more sympathetic as well and so grateful for it, but I also like realize that like, it was unhealthy definitely a little bit.",0.9573759436607361,0 days 00:41:25.200000,0 days 00:42:05.700000,05/20/21,210520_003_me.wav
195, Just kind of pointless. Are you just not really possible?,0.7904272675514221,0 days 00:42:07.200000,0 days 00:42:11.200000,05/20/21,210520_003_me.wav
196," I think I I I mean I feel like for a lot of people they have, you know, you have a little bit of both and I think when I started to feel like I was getting into the 80%, that's what I'm stopping. But like I always felt like I was like a lot of people to stop doing stuff. They really really just stops you from like pursuing things.",0.9554879665374756,0 days 00:42:18.400000,0 days 00:42:36.800000,05/20/21,210520_003_me.wav
197," So, you were saying, I returned for like, the first random shaped, like, making stuff doing stuff. They were actually remember and like, random should like in golf cart on this property.",0.8522385954856873,0 days 00:42:38.200000,0 days 00:42:52.300000,05/20/21,210520_003_me.wav
198," I think if you like or like like, when it's making music.",0.5654122233390808,0 days 00:43:00.300000,0 days 00:43:06.400000,05/20/21,210520_003_me.wav
199, Justin Bieber in Gandhi.,0.7683493494987488,0 days 00:43:08.700000,0 days 00:43:10.100000,05/20/21,210520_003_me.wav
200, Wow.,0.7290536165237427,0 days 00:43:12.800000,0 days 00:43:14.300000,05/20/21,210520_003_me.wav
201, Make that weird thing in the throat.,0.7470835447311401,0 days 00:43:16.200000,0 days 00:43:18.300000,05/20/21,210520_003_me.wav
202, This is a crazy.,0.7466239333152771,0 days 00:43:23.300000,0 days 00:43:24.700000,05/20/21,210520_003_me.wav
203, Don't make your household lose. You had like the graveyard of with it. Let me grab some before you start. I'm just going to grab some water and go to the bathroom.,0.857054591178894,0 days 00:43:37.100000,0 days 00:43:53.400000,05/20/21,210520_003_me.wav
204," Okay, how can I throw this out in the truck?",0.9031640887260437,0 days 00:44:00.600000,0 days 00:44:03.500000,05/20/21,210520_003_me.wav
