,sentence,sentence_confidence,start_time,end_time,date,original_audio
134," Google doc with like slide numbers, I mean, say then directly before this.",0.906143844127655,0 days 01:24:13.700000,0 days 01:24:26.700000,02/28/22,220228_001_me.wav
135," Customer, I do. When's the end. What about 12?",0.8514319062232971,0 days 01:24:27.700000,0 days 01:24:40.200000,02/28/22,220228_001_me.wav
136," Send picture to a 15, that's why I'm at 1:15. But like I feel like we have like a little before. I could we could just do it right before. Like it's it's usually a Time. The thing that comfortable with that thing that you want to say. So the last for like the last minute, but whatever. You see a last-minute, anything can happen, you know? Everything we know what we have to say, but, you know, you start before meeting text a minute before the time. I think that would be much better than just, what are you suggesting meeting? So, we have at least some practice before class where we practice before and coming in here.",0.9672547578811646,0 days 01:24:41.200000,0 days 01:25:36.400000,02/28/22,220228_001_me.wav
137, What's up? Why don't you wish we need to do one set to just walk in time at at least?,0.8303977847099304,0 days 01:25:41.400000,0 days 01:25:45.900000,02/28/22,220228_001_me.wav
138," Or so everyone feel free to comment on each other scraps sit down and correct them because if we come here at the correct, I think that like what the best thing to do is to if we can meet once tomorrow at like 12 or something like that cuz you have a cough right afterwards. I don't want to be like stressing, right outside here, trying to, like, run through a presentation really quickly. That's just going to be, like, not pleasant in the slightest. I think we should, we should meet at like 12:15 12:20, 12:25 and if possible, and we'll meet for 15 minutes, 20 minutes run through the presentation. One through the presentation with the slides on the computer. We can fucking do it, where I'm at, and we just fucking, we time it and we just go through it and we can give each other really quick notes.",0.9688993096351624,0 days 01:25:53,0 days 01:26:52.300000,02/28/22,220228_001_me.wav
139," And that's enough time between like that. And what I was at least, think about it before that presentation. I didn't got it.",0.8426326513290405,0 days 01:26:52.400000,0 days 01:26:58,02/28/22,220228_001_me.wav
140," Compare attic my part. I often see things that you apart, is going to take it. Take some time so that we can just allocate. I only think this is going to be pretty even allocation. I think we should spend the most time on this knee on slide 6, 7 8.",0.8923484086990356,0 days 01:27:04.300000,0 days 01:27:21.200000,02/28/22,220228_001_me.wav
141," And 9 are those in most important slides and Nate. I think it's a bit. It's a lot of those are a lot of insides and you can, I'm just wondering if I can because these the data summary and the the the to the data summary thing is good.",0.9291371703147888,0 days 01:27:22.300000,0 days 01:27:41.600000,02/28/22,220228_001_me.wav
142," Very quick, honestly, I can do that. Okay, awesome. I'll do nine 10, 11, 12 13, ask LL, fly Wild n Out because 678 a really important and for that one that went through it. I think we should need to have like, okay, let's imagine you sit down. You know, I have like a couple hypotheticals, you know.",0.9485954642295837,0 days 01:27:42.800000,0 days 01:28:09.200000,02/28/22,220228_001_me.wav
143," The same might be like, you know, imagine that you imagine like an Anime Watcher who has really strong preferences for what sound devices, David, you know it. Imagine a multilingual household evidence of like myself and like how a pension and profile setting would be an English-speaking person from the United States. Still have these sort of implicit preferences, right? For the perfect. That's that's exactly that that's that's that. Before you can do yourself a language line, is it gives him a small example for multi, You Know, The Enemy and multilingual. I think went in the second Point, by the way, no suggested language has become such abuses documents, right? It's it's like it's needed to say that like if everything is all like mixed up. It's not like organized by like most common even, you know, all I can most likely. So if you",0.9592225551605225,0 days 01:28:10.200000,0 days 01:29:04.100000,02/28/22,220228_001_me.wav
144," Set towards the specific language input that change settings. Go see manual shift. Today. It's not safe. I move into. If I, if I start a show and then click on Jammin cuz I want to watch the show and jamming, then like the playback language is Jah, man, even if I click on the different job again, something about I think I'm pretty sure that. That's what that's what they say. Like, you see, you have to go back in like manually switch these things. When you click on the new piece of content, right?",0.955524206161499,0 days 01:29:10.200000,0 days 01:29:45.900000,02/28/22,220228_001_me.wav
145," That's weird. Jasmine that can be made within like a particularly, like a particular shows. Like environment rice, what? I think. Yes, so because if you wanting a bunch of shows together, you wouldn't you want to do that, but I'm not, I'm not sure how true it is. Yeah. I'm talking about announcing the years experience. I think that's perfect.",0.939434826374054,0 days 01:29:48.900000,0 days 01:30:17.300000,02/28/22,220228_001_me.wav
146," What time you saw. This is so like it, make it a approximately like 3 minutes each for 34 minutes. Each.",0.7891488075256348,0 days 01:30:20,0 days 01:30:26.500000,02/28/22,220228_001_me.wav
147," You can't you can do yours, like instinct season one or two of those things that we wrote in the statement of walk that like the Disney is like it's like located and you know, it's like a really big company. What happened? You got it this with us that we can stop typing on this document.",0.9393775463104248,0 days 01:30:27.700000,0 days 01:30:50.400000,02/28/22,220228_001_me.wav
148, So we can like I don't know. Little Scripps. Why would you guys be 12:25 something?,0.9202784895896912,0 days 01:30:51.200000,0 days 01:30:58.800000,02/28/22,220228_001_me.wav
149," I awesome. I think we got like there's like one last bullet to change at the end in the key. Takeaways, but I can't I just got really fucking worried by Mike's response on the sea.",0.9114641547203064,0 days 01:31:04.900000,0 days 01:31:18.200000,02/28/22,220228_001_me.wav
150," Yeah, well, we also it will send that. I just want to make a sweater a nice one.",0.9189175367355347,0 days 01:31:19.300000,0 days 01:31:23.800000,02/28/22,220228_001_me.wav
151," Yeah, I mean, he's only a pretty soft-spoken guy. You know, he's like a very nice guy, like that might come me to. Yeah. I know if you could just type of scripts in there. Yeah. I'll see you guys.",0.9384629130363464,0 days 01:31:26,0 days 01:31:40.900000,02/28/22,220228_001_me.wav
152, Right.,0.5665885210037231,0 days 01:32:29.500000,0 days 01:32:30,02/28/22,220228_001_me.wav
153, Poop.,0.7157090306282043,0 days 01:33:33.500000,0 days 01:33:34.100000,02/28/22,220228_001_me.wav
154, Really?,0.950711190700531,0 days 01:48:49,0 days 01:48:50,02/28/22,220228_001_me.wav
155," Episodes. Halfway on this time. I must have like, freaking out.",0.6708476543426514,0 days 01:49:51.500000,0 days 01:49:55.100000,02/28/22,220228_001_me.wav
156, I'm just too busy.,0.9455513954162598,0 days 01:51:50.500000,0 days 01:51:51.500000,02/28/22,220228_001_me.wav
157, I'm connection.,0.866722583770752,0 days 01:51:57.400000,0 days 01:51:59.200000,02/28/22,220228_001_me.wav
158, Assign.,0.6557468175888062,0 days 01:52:00.100000,0 days 01:52:02.400000,02/28/22,220228_001_me.wav
159, Taking side.,0.5750561952590942,0 days 01:52:03.900000,0 days 01:52:04.700000,02/28/22,220228_001_me.wav
160, Itsfunneh.,0.6144132018089294,0 days 01:52:14.500000,0 days 01:52:15.300000,02/28/22,220228_001_me.wav
161, Why is that so low?,0.8306915163993835,0 days 01:52:19.200000,0 days 01:52:20.600000,02/28/22,220228_001_me.wav
162," Timeline risk. Question, is this?",0.9447509050369263,0 days 01:52:31.400000,0 days 01:52:35.500000,02/28/22,220228_001_me.wav
163, No.,0.7838850021362305,0 days 01:52:40.700000,0 days 01:52:41.300000,02/28/22,220228_001_me.wav
164, I don't know why people think something is different company.,0.837384819984436,0 days 01:52:42.300000,0 days 01:52:47.500000,02/28/22,220228_001_me.wav
165, To giving you off to you. This is necessary. Then you trying to say this is not to Disney. What's going on?,0.8925405144691467,0 days 01:52:48.800000,0 days 01:53:01.400000,02/28/22,220228_001_me.wav
166," You know, we know what's going on. Is that idea?",0.7893654108047485,0 days 01:53:03,0 days 01:53:05.700000,02/28/22,220228_001_me.wav
167, Very pretty.,0.39637291431427,0 days 01:53:07.400000,0 days 01:53:08.600000,02/28/22,220228_001_me.wav
168, I'm here. Let me see if I can make this a little bit more.,0.9506660103797913,0 days 01:53:11.700000,0 days 01:53:17.300000,02/28/22,220228_001_me.wav
169," Yeah, I do. I will.",0.9213526844978333,0 days 01:53:25.800000,0 days 01:53:28.100000,02/28/22,220228_001_me.wav
170, Not going to be out like or I went to dinner.,0.8815073370933533,0 days 01:53:31,0 days 01:53:35.400000,02/28/22,220228_001_me.wav
171, Scott's I didn't text him meeting you.,0.8240565657615662,0 days 01:53:36.400000,0 days 01:53:43.900000,02/28/22,220228_001_me.wav
172, Made.,0.788536787033081,0 days 01:53:45.600000,0 days 01:53:46.400000,02/28/22,220228_001_me.wav
173, Takeaways.,0.9282253980636597,0 days 01:53:48.100000,0 days 01:53:49.800000,02/28/22,220228_001_me.wav
174," I was at you, at you want to do?",0.8751786947250366,0 days 01:56:12.900000,0 days 01:56:14.600000,02/28/22,220228_001_me.wav
175, Free animal cotton.,0.36715590953826904,0 days 01:56:24.900000,0 days 01:56:26,02/28/22,220228_001_me.wav
176," If you come in the house, a most of them to go walk in your ass.",0.6173863410949707,0 days 01:56:28.500000,0 days 01:56:31.400000,02/28/22,220228_001_me.wav
177, I want to go get a drink up.,0.7767882943153381,0 days 01:57:24.100000,0 days 01:57:26.900000,02/28/22,220228_001_me.wav
178," The 21st, transform bearings.",0.7133404612541199,0 days 01:57:40.200000,0 days 01:57:43.400000,02/28/22,220228_001_me.wav
179, Before using chemical Agents from beings.,0.6212689876556396,0 days 01:57:47.300000,0 days 01:57:49.500000,02/28/22,220228_001_me.wav
180," Oh, yeah.",0.9581377506256104,0 days 01:57:58.700000,0 days 01:57:59.400000,02/28/22,220228_001_me.wav
181," break down and say,",0.646391749382019,0 days 01:58:01,0 days 01:58:02,02/28/22,220228_001_me.wav
182, It dropped on Grandpa. San Francisco today.,0.6647256016731262,0 days 01:58:14.500000,0 days 01:58:17.400000,02/28/22,220228_001_me.wav
183, Wren.,0.45161449909210205,0 days 01:58:18.900000,0 days 01:58:19.500000,02/28/22,220228_001_me.wav
