,sentence,sentence_confidence,start_time,end_time,date,original_audio
280," Yeah, I know, especially that I am done with this guy.",0.6749418377876282,0 days 00:52:44.800000,0 days 00:52:48,03/16/22,220316_001_me.wav
281," Yeah, I know. I must don't want my jeans. I want to. I'm like, the thing is, is that I'm giving up those dreams. Like those kinds of dreams like the dreams about being like known. And then you were gone. I had that when I was younger, but yeah, but I don't hate. You don't feel that way. I feel all I want to do is I want to contribute and know that. That's something meaningful. I live a good fucking life with a good fucking community.",0.9110910892486572,0 days 00:52:59.200000,0 days 00:53:27.200000,03/16/22,220316_001_me.wav
282," Honestly, I think all you really want is respect. And if I have that respect for the people that it matches for that literally, all that matters to me. I think it's like, that's why I, like, how are you asking and your parents eyes and biggest thing. If I make my parents proud, if I make my parents and my friends. The Grapevine life biggest fucking life.",0.9476771354675293,0 days 00:53:29.900000,0 days 00:53:59.700000,03/16/22,220316_001_me.wav
283, I think so.,0.6116998195648193,0 days 00:54:00.700000,0 days 00:54:03.400000,03/16/22,220316_001_me.wav
284," That's what I'm saying. That's why that's why I like and that's what that's what I really want to have that like like a little bit of respect by way of achieving it. I mean the biggest reason kind of why I want to pay it today. Like you've done something already. You contribute its academic, what I've always done, even if you don't do it like,",0.9408969879150391,0 days 00:54:07.200000,0 days 00:54:39.100000,03/16/22,220316_001_me.wav
285, And that might be like totally misguided of me and I'm ready to get totally fooled.,0.9327265620231628,0 days 00:54:44.600000,0 days 00:54:48.600000,03/16/22,220316_001_me.wav
286," You know what? I mean, but it's like it. So it's sort of like once I guess that it's like, for me it's like, I'm like,",0.869055986404419,0 days 00:54:50.100000,0 days 00:54:58.300000,03/16/22,220316_001_me.wav
287," No, and no.",0.5327429175376892,0 days 00:55:01.300000,0 days 00:55:02.300000,03/16/22,220316_001_me.wav
288, Good night. I'm not using it as an insurance policy. I thinking positive about that.,0.905718982219696,0 days 00:55:04.900000,0 days 00:55:11.100000,03/16/22,220316_001_me.wav
289," But like I think most of it is the feeling that like I barely learned anything so far. Like, I've, I've liked Donald, it's like felt like I'm talking about the introductory classes stock at their whatever, and it feels like I'm like hopelessly not finished with my studies.",0.925825834274292,0 days 00:55:12.300000,0 days 00:55:28.900000,03/16/22,220316_001_me.wav
290, Gracias.,0.6183757781982422,0 days 00:55:30.200000,0 days 00:55:31.300000,03/16/22,220316_001_me.wav
291," Passing the main reason for wanting to do it. It's like I just feel like I haven't really. Like I only got I've seen and Clements, you know, the frontier that you know, the truth that you know, some of this sort of like it the possibility, you know, also do a lot of studying you we have prepared and all these disciplines in order to tackle these things. At the, any women undergrad in particular. It's like it's like baby Latias.",0.913570761680603,0 days 00:55:34.200000,0 days 00:55:59.200000,03/16/22,220316_001_me.wav
292," No, it isn't. It is fucking baby stops. You get a patent on the like if you see this shit like that. I'm in opposition course would like off with seniors in mud, doing home sign. If I can get these kids do nothing. You don't know anything until you actually like all until you walked like seven. Like this is our toilet is not Justin C.",0.9037354588508606,0 days 00:56:02.700000,0 days 00:56:25.800000,03/16/22,220316_001_me.wav
293," It's like literally every why you having that she taught stop, like the real shit like thing is you lying to me.",0.7545546889305115,0 days 00:56:26.900000,0 days 00:56:34,03/16/22,220316_001_me.wav
294," Yes, where you watching the 100 different variations of the method?",0.8887112140655518,0 days 00:56:37,0 days 00:56:41.400000,03/16/22,220316_001_me.wav
295," It's like the equivalent of 6 equivalent of a, taking a knife, cutting class in like a coloring school. And there's not cooking ingredients made it into something and that's what like,",0.9246180057525635,0 days 00:56:46.100000,0 days 00:57:03.400000,03/16/22,220316_001_me.wav
296, One last picture.,0.9598143696784973,0 days 00:57:08.400000,0 days 00:57:10.700000,03/16/22,220316_001_me.wav
297, I'm going to get something ready.,0.9073872566223145,0 days 00:57:13.400000,0 days 00:57:14.600000,03/16/22,220316_001_me.wav
298, They never turn out while. I just want to try it once.,0.761263370513916,0 days 00:57:19.300000,0 days 00:57:21.900000,03/16/22,220316_001_me.wav
299, The last picture we paid like a couple bucks score.,0.7822510004043579,0 days 00:57:22.800000,0 days 00:57:25,03/16/22,220316_001_me.wav
300," also feature, we paid a couple bucks for",0.8574658036231995,0 days 00:57:26,0 days 00:57:27.900000,03/16/22,220316_001_me.wav
301, You have to use it.,0.699787437915802,0 days 00:57:29.600000,0 days 00:57:31.800000,03/16/22,220316_001_me.wav
302, Would you like Shop videos and stuff over over a cup of coffee? And then I'm going to order around the coffee in the round?,0.8345078229904175,0 days 00:57:35.100000,0 days 00:57:42.600000,03/16/22,220316_001_me.wav
303, I am so excited.,0.982463002204895,0 days 00:57:43.200000,0 days 00:57:46.900000,03/16/22,220316_001_me.wav
304," Oh, yeah.",0.9582626819610596,0 days 00:57:50.800000,0 days 00:57:51.500000,03/16/22,220316_001_me.wav
305, Although I might have to eat.,0.9197549223899841,0 days 00:57:52.800000,0 days 00:57:53.900000,03/16/22,220316_001_me.wav
306," What is the name of the scale? I just don't want to, I don't want to play.",0.7156312465667725,0 days 00:58:00,0 days 00:58:10.300000,03/16/22,220316_001_me.wav
307, Really?,0.9876290559768677,0 days 00:58:14.300000,0 days 00:58:14.700000,03/16/22,220316_001_me.wav
308," I'm leaving like the ideas like ever find a deal like absent. So I can put their competition, you know, what faction apps and apps and comparison. No, cuz I think I think that means that makes it like you. You can lose it.",0.8942177295684814,0 days 00:58:16.100000,0 days 00:58:30.300000,03/16/22,220316_001_me.wav
309," You know, I packed my confidence, this over the best, the best dollar, you know what I mean? Cuz if you pack it to the anxious, you know what I mean? Instead to you know, just the sauce instead of undying sort of idea of sort of like an ID ideals and pop action and you know, all that kid Perfection, but you know what I mean, but you said your problem was",0.9324547648429871,0 days 00:58:31.700000,0 days 00:59:03.200000,03/16/22,220316_001_me.wav
310," Yeah, I know I can.",0.9543522000312805,0 days 00:59:04,0 days 00:59:07.300000,03/16/22,220316_001_me.wav
311, Hello. Hello.,0.5376424789428711,0 days 00:59:16,0 days 00:59:17,03/16/22,220316_001_me.wav
312, Lucius Malfoy's better than you. Yeah. Yes.,0.7076593637466431,0 days 00:59:24.800000,0 days 00:59:28.400000,03/16/22,220316_001_me.wav
313, Channel 3.,0.8401932120323181,0 days 00:59:37.400000,0 days 00:59:38.100000,03/16/22,220316_001_me.wav
314," Yeah, that might be. That's fine. But like in the thing is is that ultimately what I think it's not like that it's based on his route. So it's just it's just that you pay assassin idea of yourself to the actions that could do it. You know, I'm not like losing a game of chaste me and something, you know, deep down. It's like it just like a method for like",0.9069730043411255,0 days 00:59:42.800000,0 days 01:00:09.100000,03/16/22,220316_001_me.wav
315," Hockey's, just saw the Viking.",0.6296597123146057,0 days 01:00:11.200000,0 days 01:00:13,03/16/22,220316_001_me.wav
316," Yes, I bought popping up some kind of internal sense of whatever.",0.8270025849342346,0 days 01:00:16.100000,0 days 01:00:20.100000,03/16/22,220316_001_me.wav
317, That's what's up. Leave. I haven't like Dawson go to then you can pass through the sports.,0.8796835541725159,0 days 01:00:21.400000,0 days 01:00:24.900000,03/16/22,220316_001_me.wav
318," You know, I don't like sports besides it for that reason. I don't like saying things. What? People like, super Compassus it. Yeah. I know. I just it just, it just doesn't walk to me. I just don't like it. It's like, it's like, it's especially, especially because it's asinine",0.9291571974754333,0 days 01:00:26.400000,0 days 01:00:41.600000,03/16/22,220316_001_me.wav
319, Yeah.,0.8488325476646423,0 days 01:00:55.900000,0 days 01:00:56.300000,03/16/22,220316_001_me.wav
320," Yeah, I know that's just like foxes.",0.8693676590919495,0 days 01:00:59.500000,0 days 01:01:02,03/16/22,220316_001_me.wav
321," There's also like it like it. The thing is I I just didn't think, I think I'm just taking a little bit of a different view like who might compete against, you know.",0.9116122722625732,0 days 01:01:12.600000,0 days 01:01:20.700000,03/16/22,220316_001_me.wav
322, I don't.,0.9822127819061279,0 days 01:01:22.800000,0 days 01:01:23.300000,03/16/22,220316_001_me.wav
323, Yeah. Yeah. I know hundred percent for you.,0.8847788572311401,0 days 01:01:26.800000,0 days 01:01:30,03/16/22,220316_001_me.wav
324," When you're with him because it's just like, yeah.",0.939763069152832,0 days 01:01:33.700000,0 days 01:01:52.300000,03/16/22,220316_001_me.wav
325, Up to the lake. You are almost at the one kilometer Mark and there are nine more.,0.9099020957946777,0 days 01:01:59,0 days 01:02:04.400000,03/16/22,220316_001_me.wav
326, Yes.,0.9592331647872925,0 days 01:02:08.700000,0 days 01:02:09.200000,03/16/22,220316_001_me.wav
327, Never like I think we're like two evenly-matched Snapchats.,0.8298056721687317,0 days 01:02:14.100000,0 days 01:02:16.600000,03/16/22,220316_001_me.wav
328," Like I was like I was like, I was like bad before I better things but like I don't like to get better at things like relative to all the people. I think relative to yourself. It's my favorite way.",0.9454362988471985,0 days 01:02:21.900000,0 days 01:02:42.500000,03/16/22,220316_001_me.wav
329," Well, that's true.",0.7581210732460022,0 days 01:02:45.100000,0 days 01:02:47.800000,03/16/22,220316_001_me.wav
330, Yeah.,0.8487683534622192,0 days 01:02:49.100000,0 days 01:02:49.500000,03/16/22,220316_001_me.wav
331, Really?,0.9817748665809631,0 days 01:02:53.900000,0 days 01:02:54.500000,03/16/22,220316_001_me.wav
332, I know. My life is like hard walking down here with the celebration. Yeah.,0.9004656672477722,0 days 01:02:56.200000,0 days 01:03:09.900000,03/16/22,220316_001_me.wav
333," Play, I think one of the main things like about competition is that like it really just dropped from like the Buddhist teachings, you know things so you just yeah, I know.",0.8450562357902527,0 days 01:03:14.200000,0 days 01:03:29.400000,03/16/22,220316_001_me.wav
334," Yeah, I know now I can send him any more experience.",0.827894926071167,0 days 01:03:38.700000,0 days 01:03:44.400000,03/16/22,220316_001_me.wav
335," All my bought two, that would have sucked.",0.9068017601966858,0 days 01:03:52.200000,0 days 01:03:55.400000,03/16/22,220316_001_me.wav
336, Yacht breakfast tomorrow morning at the hotel. Continental breakfast.,0.8768077492713928,0 days 01:03:57.400000,0 days 01:04:02.300000,03/16/22,220316_001_me.wav
337," I didn't mean Isis at. Oh, you know, I think, I think Alyssa rationed sometimes teaches us.",0.7684736251831055,0 days 01:04:04.500000,0 days 01:04:20,03/16/22,220316_001_me.wav
338," How about if I think alliteration teaches us about what is rice, like, naturally bug is in bed and something tastic.",0.8431496620178223,0 days 01:04:20.900000,0 days 01:04:30.300000,03/16/22,220316_001_me.wav
339, Ola bike is beyond my favorite.,0.6392480731010437,0 days 01:04:31.700000,0 days 01:04:37.200000,03/16/22,220316_001_me.wav
340," Back is beer in bed. Those look up. Look up the nicest place, but we can also check out my parents. Will anybody? And yeah, yes.",0.8949657678604126,0 days 01:04:39.900000,0 days 01:04:55.400000,03/16/22,220316_001_me.wav
341," Yeah, I do want that cash. Cuz then we can, I see pay with all my God. Oh my God, no people exchange. The blue dollar rate in town and I have like 50 bucks, a fuck is going to be enough to do that 10.",0.9293147325515747,0 days 01:04:57.500000,0 days 01:05:12.800000,03/16/22,220316_001_me.wav
342, November 10th is going to be more responsive. I feel I guess now's the time will be expensive.,0.9001384377479553,0 days 01:05:16.800000,0 days 01:05:23.700000,03/16/22,220316_001_me.wav
343," Yeah, cuz I got was that was like the West 10th experience.",0.8826670050621033,0 days 01:05:27.800000,0 days 01:05:31.700000,03/16/22,220316_001_me.wav
344," I'm at least, I won't have to pay for like the little hole that we made.",0.8976033926010132,0 days 01:05:32.900000,0 days 01:05:35.800000,03/16/22,220316_001_me.wav
345," Orthodontist, we can argue that like, look, does it mean you gave us his tent? Although you knew this, it was broke.",0.8442361950874329,0 days 01:05:39.300000,0 days 01:05:45,03/16/22,220316_001_me.wav
346," Yep, we almost like to drop. We almost and dropped it in Spanish. We almost dropped it in Spanish in Google Translate, just to make sure that I point is",0.9378529787063599,0 days 01:05:48.800000,0 days 01:05:56.800000,03/16/22,220316_001_me.wav
347," What? Yeah, I know. That's why I'm saying we should we should we should compose in Spanish when we sit down and just like bring it and be like, y'all know, we will pay for this but like, got this out of commission. The thing is is that there's we should say that we created a whole I'd only like lie about that.",0.9608281850814819,0 days 01:05:58,0 days 01:06:17.700000,03/16/22,220316_001_me.wav
348," That hole was only created because of that, broken zipper.",0.8553457260131836,0 days 01:06:18.900000,0 days 01:06:23.200000,03/16/22,220316_001_me.wav
349, The zipper wasn't your type the other that's Troy on it.,0.5744526982307434,0 days 01:06:29.600000,0 days 01:06:32.200000,03/16/22,220316_001_me.wav
350," All those, I was in. Why we went? We came back. I think that this is not the only reason.",0.8813318014144897,0 days 01:06:36.100000,0 days 01:06:40.500000,03/16/22,220316_001_me.wav
351, News on the rationalization of Saving Face and saving like the region which they like Ladle out in like it.,0.8161063194274902,0 days 01:06:43.600000,0 days 01:06:50.400000,03/16/22,220316_001_me.wav
352," Do not be polluted by take me to. Yes, as long as long as I don't like losing it. I don't want to give them the satisfaction. It's not like I, unlike, you know, I just don't want to give them a difference.",0.9504767060279846,0 days 01:06:53.900000,0 days 01:07:17.400000,03/16/22,220316_001_me.wav
353," Like, I'm totally fine and being an apps.",0.9024632573127747,0 days 01:07:18.500000,0 days 01:07:20.600000,03/16/22,220316_001_me.wav
354," Then what what, who who wouldn't know Everyone likes?",0.7674500942230225,0 days 01:07:27.800000,0 days 01:07:38.900000,03/16/22,220316_001_me.wav
355, Maybe that's not the best place in town.,0.9807289838790894,0 days 01:07:41.200000,0 days 01:07:42.900000,03/16/22,220316_001_me.wav
356, We should find the best place in town and go then.,0.9274940490722656,0 days 01:07:44.700000,0 days 01:07:46.900000,03/16/22,220316_001_me.wav
357, Were they?,0.46084487438201904,0 days 01:07:50.200000,0 days 01:07:50.800000,03/16/22,220316_001_me.wav
358," Well, that was like, they're like some, Like Houses over there, like, maybe that, like orange house or that like it, you know, that like big red house up to open up that, you know, that might be like, other Hotel type is established that have more rooms potentially, but I think we should just to go for it.",0.950681746006012,0 days 01:07:52,0 days 01:08:09.700000,03/16/22,220316_001_me.wav
359," Oh, yeah, like no communal.",0.8888471722602844,0 days 01:08:10.800000,0 days 01:08:13.300000,03/16/22,220316_001_me.wav
360, No communal toilets for me.,0.8853790163993835,0 days 01:08:14.600000,0 days 01:08:16.100000,03/16/22,220316_001_me.wav
361," Play Knock knock. Some of the best sleep, some of the best washers in the basket coffee, and tea, and everything. Yeah.",0.851506233215332,0 days 01:08:21.700000,0 days 01:08:31.500000,03/16/22,220316_001_me.wav
362," Yeah, I'm just extremely excited.",0.966934859752655,0 days 01:08:41.600000,0 days 01:08:45.200000,03/16/22,220316_001_me.wav
363," Yeah, it's Wednesday.",0.9180793762207031,0 days 01:08:49.600000,0 days 01:08:52.300000,03/16/22,220316_001_me.wav
364, Is Los Angeles mansion?,0.6365968585014343,0 days 01:08:53.100000,0 days 01:09:00.200000,03/16/22,220316_001_me.wav
365, It's okay.,0.6876406073570251,0 days 01:09:01.500000,0 days 01:09:03.100000,03/16/22,220316_001_me.wav
366," Yo, can we could also do not even tell them?",0.904868483543396,0 days 01:09:06.800000,0 days 01:09:10.500000,03/16/22,220316_001_me.wav
367, I have a privacy being somewhere likes in secret. So I'm just like just chilling out.,0.8398677110671997,0 days 01:09:12.100000,0 days 01:09:29,03/16/22,220316_001_me.wav
368," Yeah, I know and we go to the hospital while they book book process.",0.8870750665664673,0 days 01:09:39.600000,0 days 01:09:44.400000,03/16/22,220316_001_me.wav
369," Yeah, they like seafood soup.",0.7552815675735474,0 days 01:09:47.200000,0 days 01:09:49.100000,03/16/22,220316_001_me.wav
370, Beautiful. Beautiful.,0.9114565849304199,0 days 01:09:57.700000,0 days 01:10:01.700000,03/16/22,220316_001_me.wav
371, Call a baton.,0.8000233769416809,0 days 01:10:09.300000,0 days 01:10:10.300000,03/16/22,220316_001_me.wav
372, And we can give him a call.,0.8860763907432556,0 days 01:10:20,0 days 01:10:21.100000,03/16/22,220316_001_me.wav
373, Publix.,0.39212843775749207,0 days 01:10:24.800000,0 days 01:10:25.400000,03/16/22,220316_001_me.wav
374," You're even a hostel, hostel would be fantastic.",0.8138999938964844,0 days 01:10:32,0 days 01:10:35.500000,03/16/22,220316_001_me.wav
375," So, it's pretty clean.",0.7931299805641174,0 days 01:10:37.600000,0 days 01:10:38.800000,03/16/22,220316_001_me.wav
376," Parish shorts with me. Oh, a hundred percent, of course.",0.8847182393074036,0 days 01:10:41.300000,0 days 01:10:46.200000,03/16/22,220316_001_me.wav
377, I'll be fantastic.,0.5352514386177063,0 days 01:10:47.900000,0 days 01:10:49.200000,03/16/22,220316_001_me.wav
378, The problem about the Taurus Venus of this town is at the blue dollar like is negated a little bit. The blue dollar in the Gated a tiny bit by being in like a town. That is a tourist town.,0.9213618040084839,0 days 01:10:52.500000,0 days 01:11:03.800000,03/16/22,220316_001_me.wav
379," Like no, no, you know.",0.8144089579582214,0 days 01:11:04.800000,0 days 01:11:07.500000,03/16/22,220316_001_me.wav
380," She hot like, you know, how how the Tim's wasn't in control of the Spanish one would like to have prices know. I'm not sure what like,",0.8590983748435974,0 days 01:11:11.200000,0 days 01:11:20.200000,03/16/22,220316_001_me.wav
381," Holy shit, Alicia.",0.5706386566162109,0 days 01:11:21.300000,0 days 01:11:24.300000,03/16/22,220316_001_me.wav
382, How do you spell charges?,0.9477950930595398,0 days 01:11:26.700000,0 days 01:11:27.800000,03/16/22,220316_001_me.wav
383, Although I can only just get me a bath.,0.9464857578277588,0 days 01:11:32,0 days 01:11:36.100000,03/16/22,220316_001_me.wav
384, Let's not spend it. Yes. Fucking spend some money. That's it. Going to be like the most W that luxury stay at.,0.874869704246521,0 days 01:11:39.100000,0 days 01:11:45.900000,03/16/22,220316_001_me.wav
385," Oh, yeah. Is the relative distance between a regular life and that luxury. Right now? I'd like regular life has been like a. So this will be the fastest differential to ever exist. And that makes it like 10 times more with it.",0.9401862621307373,0 days 01:11:51.800000,0 days 01:12:18,03/16/22,220316_001_me.wav
386, That's fine. That shit doesn't spend all our cash.,0.786064624786377,0 days 01:12:23.500000,0 days 01:12:26.600000,03/16/22,220316_001_me.wav
387, Dislike hobbling along.,0.8442096710205078,0 days 01:12:29.100000,0 days 01:12:31.400000,03/16/22,220316_001_me.wav
388," Yeah, I know like my glutes. I just like in pain. I'm so happy for the last night.",0.9010679721832275,0 days 01:12:33.600000,0 days 01:12:46.700000,03/16/22,220316_001_me.wav
389," Oh, I know rain coming in Like Mike.",0.9126892685890198,0 days 01:12:49.700000,0 days 01:12:55.100000,03/16/22,220316_001_me.wav
390, I know real quick.,0.8796068429946899,0 days 01:12:57,0 days 01:13:09.500000,03/16/22,220316_001_me.wav
391, Clear out the trash.,0.9135693311691284,0 days 01:13:12.800000,0 days 01:13:14,03/16/22,220316_001_me.wav
392," Yeah, I'm just regular.",0.7170124650001526,0 days 01:13:18.800000,0 days 01:13:20.500000,03/16/22,220316_001_me.wav
393, You want to split it?,0.7604554295539856,0 days 01:13:22.800000,0 days 01:13:23.700000,03/16/22,220316_001_me.wav
394, We can do.,0.7745678424835205,0 days 01:13:24.900000,0 days 01:13:25.500000,03/16/22,220316_001_me.wav
395, Washington.,0.7938593029975891,0 days 01:13:30.500000,0 days 01:13:31.100000,03/16/22,220316_001_me.wav
396," There's a trash can coming up as well for the Lost, check for most of the ship we can do.",0.8176864385604858,0 days 01:13:33.200000,0 days 01:13:37.900000,03/16/22,220316_001_me.wav
397, Yeah.,0.8477314710617065,0 days 01:13:42.600000,0 days 01:13:43,03/16/22,220316_001_me.wav
398, What's up?,0.9390683174133301,0 days 01:13:50.700000,0 days 01:13:51.300000,03/16/22,220316_001_me.wav
399," That's good, though. Past complete, Utah.",0.7275106906890869,0 days 01:14:06,0 days 01:14:11.400000,03/16/22,220316_001_me.wav
400," Cleaning up. Yeah, but fastest just drop it off and then we'll go get some food. Fast places to stay al-shallal time.",0.9028770923614502,0 days 01:14:12.500000,0 days 01:14:21.800000,03/16/22,220316_001_me.wav
401," Oh, that's kind of Massage.",0.6975089311599731,0 days 01:14:26.600000,0 days 01:14:28.800000,03/16/22,220316_001_me.wav
402," Which one? This one? Yo, I need to go to this point. It's not like I'm not, I'm not like physically hungry. I'm not I'm not, I'm not hungry but my stomach like the acid, no less than, you know, I mean",0.8960553407669067,0 days 01:14:33.400000,0 days 01:14:57.900000,03/16/22,220316_001_me.wav
403," I'm looking for like, you know, how that you know delayed gratitude, you know, like the lady old lady gratification. This is like the peen tell me then.",0.8924465775489807,0 days 01:14:59.900000,0 days 01:15:09.100000,03/16/22,220316_001_me.wav
404, Adesa Austin.,0.7874400615692139,0 days 01:15:15.600000,0 days 01:15:18.200000,03/16/22,220316_001_me.wav
405, Know how? I know. Don't look.,0.7216492295265198,0 days 01:15:19.700000,0 days 01:15:21.900000,03/16/22,220316_001_me.wav
406, Look at that face.,0.5760024785995483,0 days 01:15:24.200000,0 days 01:15:25.100000,03/16/22,220316_001_me.wav
407, Remind me to death.,0.7594691514968872,0 days 01:15:26.600000,0 days 01:15:27.500000,03/16/22,220316_001_me.wav
408, Is a goat.,0.6435994505882263,0 days 01:15:28.700000,0 days 01:15:29.600000,03/16/22,220316_001_me.wav
409, It's like a dream that red house up there.,0.9066458940505981,0 days 01:15:31.500000,0 days 01:15:35.600000,03/16/22,220316_001_me.wav
410," And what about that? Looks like, smoking hotels to me.",0.8935840725898743,0 days 01:15:39.600000,0 days 01:15:42,03/16/22,220316_001_me.wav
411," 100% like a hundred bucks, whatever, if there's anything underneath, 200, 200 for one night, will do it. Oh my God.",0.8297631144523621,0 days 01:15:49.800000,0 days 01:16:03.800000,03/16/22,220316_001_me.wav
412, This place hasn't bought.,0.5104912519454956,0 days 01:16:14.500000,0 days 01:16:15.600000,03/16/22,220316_001_me.wav
413," Yeah, I know. Maybe they're going to dinner and breakfast or they closed.",0.8070616126060486,0 days 01:16:20.500000,0 days 01:16:26.300000,03/16/22,220316_001_me.wav
414, Soaking it up.,0.4878506362438202,0 days 01:16:29.800000,0 days 01:16:30.600000,03/16/22,220316_001_me.wav
415," Hola, do you guys have a room by any chance? Yes, no room.",0.8305625915527344,0 days 01:16:33.300000,0 days 01:16:39.800000,03/16/22,220316_001_me.wav
416," Okay, so",0.9713379144668579,0 days 01:16:46.800000,0 days 01:16:48.300000,03/16/22,220316_001_me.wav
417, Change. Cuz she has told me the keys behind.,0.7274690270423889,0 days 01:16:53.300000,0 days 01:16:55.300000,03/16/22,220316_001_me.wav
418, Every place to have a jump on data.,0.7011043429374695,0 days 01:16:59,0 days 01:17:04,03/16/22,220316_001_me.wav
419," Let's see if we can book online music book online for today, you know.",0.9204109907150269,0 days 01:17:08,0 days 01:17:11.800000,03/16/22,220316_001_me.wav
420," Okay, good boy.",0.7377939820289612,0 days 01:17:12.800000,0 days 01:17:13.700000,03/16/22,220316_001_me.wav
421," Yeah, let's let's sit outside the party going to the hospital and then just booked and book some place and time and we'll go that. I don't think I don't think like walking somewhere is going to how is everyone? Which is not like, they're not peanut people. Like people aren't like stuffing in this time.",0.938366711139679,0 days 01:17:20.900000,0 days 01:17:38.100000,03/16/22,220316_001_me.wav
422, 00.,0.49154970049858093,0 days 01:17:45.800000,0 days 01:17:48.600000,03/16/22,220316_001_me.wav
423, 24-hour place. That was horrible.,0.9224399328231812,0 days 01:17:53.300000,0 days 01:17:55.800000,03/16/22,220316_001_me.wav
424, What you don't like the hostel? I should really like the hospital.,0.863169252872467,0 days 01:17:57.500000,0 days 01:18:00.500000,03/16/22,220316_001_me.wav
